date,title,description,close,high,low,open,symbol,volume,id,key,subkey,updated,changeOverTime,marketChangeOverTime,uOpen,uClose,uHigh,uLow,uVolume,fOpen,fClose,fHigh,fLow,fVolume,label,change,changePercent
"July 13, 2020",Premier Inc. ProvideGx™ Program Partners with Fresenius Kabi to Secure the Supply of Sedation Drug Essential for COVID-19 Care,"Premier Inc. (NASDAQ: PINC), through its ProvideGx™ program, has partnered with Fresenius Kabi to supply Diprivan® (propofol) injectable emulsion, USP to healthcare providers, helping to stabilize the...",31.2,31.905,31.17,31.87,PINC,363181,HISTORICAL_PRICES,PINC,,1614385072000,0.10481586402266292,0.10481586402266292,31.87,31.2,31.905,31.17,363181,31.3328,30.6741,31.3672,30.6446,363181,"Jul 13, 20",-0.4800000000000004,-0.0152
"July 13, 2020",Pfizer and BioNTech Granted FDA Fast Track Designation for Two Investigational mRNA-based Vaccine Candidates Against SARS-CoV-2,"Pfizer Inc. (NYSE: PFE) and BioNTech SE (Nasdaq: BNTX, “BioNTech”) today announced that two of the companies’ four investigational vaccine candidates from their BNT162 mRNA-based vaccine program (BNT1...",35.21,35.72,34.52,34.73,PFE,53670893,HISTORICAL_PRICES,PFE,,1611800325000,0.1835294117647059,0.1835294117647059,34.73,35.21,35.72,34.52,53670893,33.6774,34.1428,34.6374,33.4737,53670893,"Jul 13, 20",1.3800000000000026,0.0408
"July 13, 2020",Axonics® Reports Preliminary Second Quarter 2020 Revenue,"Axonics Modulation Technologies, Inc. (NASDAQ: AXNX), a medical technology company that has developed and is commercializing novel implantable sacral neuromodulation (SNM) devices for the treatment of...",37.71,41.845,37.43,40.9,AXNX,1267809,HISTORICAL_PRICES,AXNX,,1606830572000,0.6902734199910355,0.6902734199910355,40.9,37.71,41.845,37.43,1267809,40.9,37.71,41.845,37.43,1267809,"Jul 13, 20",-1.6300000000000026,-0.0414
"July 10, 2020",Gilead Presents Additional Data on Investigational Antiviral Remdesivir for the Treatment of COVID-19,"Gilead Sciences, Inc. (Nasdaq: GILD) today announced additional data on remdesivir, an investigational antiviral for the treatment of COVID-19, adding to the available body of knowledge on treatment o...",76.32,76.85,75.52,76.1,GILD,9553834,HISTORICAL_PRICES,GILD,,1615518989000,0.09560723514211882,0.09560723514211882,76.1,76.32,76.85,75.52,9553834,73.63,73.8429,74.3557,73.0688,9553834,"Jul 10, 20",1.6099999999999994,0.0215
"July 10, 2020",Amneal Launches Generic Fluphenazine Following ANDA Approval by FDA,"Amneal Pharmaceuticals, Inc. (NYSE: AMRX) (“Amneal” or the “Company”) today announced that it has received Abbreviated New Drug Application (ANDA) approval from the U.S. Food and Drug Administration (...",4.65,4.72,4.3,4.31,AMRX,1536202,HISTORICAL_PRICES,AMRX,,1606830572000,0.332378223495702,0.332378223495702,4.31,4.65,4.72,4.3,1536202,4.31,4.65,4.72,4.3,1536202,"Jul 10, 20",0.29000000000000004,0.0665
"July 9, 2020",Puma Biotechnology Reports Inducement Awards Under Nasdaq Listing Rule 5635(c)(4),"Puma Biotechnology, Inc. (NASDAQ: PBYI), a biopharmaceutical company, announced that on July 8, 2020 the Compensation Committee of Puma’s Board of Directors approved the grant of inducement restricted...",10.24,10.41,9.97,10.2,PBYI,1212123,HISTORICAL_PRICES,PBYI,,1606830572000,0.10702702702702704,0.10702702702702704,10.2,10.24,10.41,9.97,1212123,10.2,10.24,10.41,9.97,1212123,"Jul 9, 20",0.009999999999999787,0.001
"July 9, 2020",Shareholder Alert: Robbins LLP Reminds Investors Co-Diagnostics Inc. (CODX) Sued for Misleading Shareholders,Shareholder rights law firm Robbins LLP reminds investors that a purchaser of Co-Diagnostics Inc. (NASDAQ: CODX) filed a class action complaint against the Company for alleged violations of the Securi...,18.01,19,17.56,18.82,CODX,2182945,HISTORICAL_PRICES,CODX,,1606830572000,1.0100446428571428,1.0100446428571428,18.82,18.01,19,17.56,2182945,18.82,18.01,19,17.56,2182945,"Jul 9, 20",-0.9599999999999973,-0.0506
"July 9, 2020",Shareholder Alert: Robbins LLP Is Investigating the Officers and Directors of Acer Therapeutics Inc. (ACER),"Shareholder rights law firm Robbins LLP announces that it is investigating the officers and directors of Acer Therapeutics Inc. (NYSE: ACER) for breaches of fiduciary duty, waste of corporate assets,...",3.63,3.78,3.33,3.75,ACER,871029,HISTORICAL_PRICES,ACER,,1606830572000,0.8426395939086294,0.8426395939086294,3.75,3.63,3.78,3.33,871029,3.75,3.63,3.78,3.33,871029,"Jul 9, 20",0.4099999999999997,0.1273
"July 9, 2020",CMS Establishes Unique J-Code for Eagle Pharmaceuticals’ PEMFEXY™ (Pemetrexed for Injection),"Eagle Pharmaceuticals, Inc. (“Eagle” or the “Company”) (NASDAQ: EGRX) today announced that the Centers for Medicare & Medicaid Services (CMS) has established a unique, product-specific billing cod...",47.22,47.85,45.04,46.37,EGRX,153446,HISTORICAL_PRICES,EGRX,,1606830572000,0.13892908827785813,0.13892908827785813,46.37,47.22,47.85,45.04,153446,46.37,47.22,47.85,45.04,153446,"Jul 9, 20",0.8699999999999974,0.0188
"July 9, 2020",The Law Offices of Frank R. Cruz Continues Its Investigation of Verrica Pharmaceuticals Inc. (VRCA) on Behalf of Investors,"The Law Offices of Frank R. Cruz continues its investigation on behalf of Verrica Pharmaceuticals Inc. (""Verrica"" or the ""Company"") (NASDAQ: VRCA) investors concerning the Company and its officers’ po...",8.76,9.0666,8.2924,8.9,VRCA,154351,HISTORICAL_PRICES,VRCA,,1606830572000,-0.2268314210061783,-0.2268314210061783,8.9,8.76,9.0666,8.2924,154351,8.9,8.76,9.0666,8.2924,154351,"Jul 9, 20",-0.040000000000000924,-0.0045
"July 9, 2020",Baxter Announces U.S. FDA Clearance of Altapore Shape Bioactive Bone Graft for Use in Surgery,"Baxter International Inc. (NYSE:BAX), a global leader in advancing surgical innovation, today announced U.S. Food and Drug Administration (FDA) clearance of Altapore Shape Bioactive Bone Graft, the la...",85.69,86.01,84.2,84.2,BAX,2445834,HISTORICAL_PRICES,BAX,,1614219404000,0.1647410629332609,0.1647410629332609,84.2,85.69,86.01,84.2,2445834,83.4303,84.9067,85.2237,83.4303,2445834,"Jul 9, 20",1.509999999999991,0.0179
"July 9, 2020","Centers for Medicare & Medicaid Services (CMS) Issues Permanent J-Code for TEPEZZA® (teprotumumab-trbw) Effective Oct. 1, 2020","Horizon Therapeutics plc (Nasdaq: HZNP) today announced that the U.S. Centers for Medicare and Medicaid Services (CMS) has assigned a permanent, product-specific Healthcare Common Procedure Coding Sys...",58,59.21,56.89,59.02,HZNP,1905287,HISTORICAL_PRICES,HZNP,,1606830572000,1.0523708421797593,1.0523708421797593,59.02,58,59.21,56.89,1905287,59.02,58,59.21,56.89,1905287,"Jul 9, 20",-0.759999999999998,-0.0129
"July 9, 2020","Enanta Pharmaceuticals Announces Clinical Trial Progress for EDP-514, its Lead Core Inhibitor for Hepatitis B Virus","Enanta Pharmaceuticals, Inc., (NASDAQ: ENTA), a clinical-stage biotechnology company dedicated to creating small molecule drugs for viral infections and liver diseases, today announced advancements in...",51.1,51.99,49.99,49.99,ENTA,156408,HISTORICAL_PRICES,ENTA,,1606830572000,0.09586103366931158,0.09586103366931158,49.99,51.1,51.99,49.99,156408,49.99,51.1,51.99,49.99,156408,"Jul 9, 20",0.7800000000000011,0.0155
"July 9, 2020",FDA Grants Priority Review to Merck’s Supplemental Biologics License Application for KEYTRUDA® (pembrolizumab) for Second-Line Treatment of Patients With Relapsed or Refractory Classical Hodgkin Lymphoma,"Merck (NYSE: MRK), known as MSD outside the United States and Canada, today announced that the U.S. Food and Drug Administration (FDA) has accepted and granted priority review for a new supplemental B...",76.69,78.35,76.04,77.94,MRK,7601213,HISTORICAL_PRICES,MRK,,1615519019000,0.124157138669012,0.124157138669012,77.94,76.69,78.35,76.04,7601213,76.1023,74.8818,76.5027,74.2471,7601213,"Jul 9, 20",-1.230000000000004,-0.0158
"July 9, 2020",Applied DNA Forms Clinical Testing Subsidiary to Maximize Utility of FDA EUA-Approved Linea™ COVID-19 Assay Kit and Expands Utility with Successful EUA Amendment,"Applied DNA Sciences Inc. (NASDAQ: APDN) (“Applied DNA” or the “Company”) a leader in Polymerase Chain Reaction (PCR)-based DNA manufacturing that enables in vitro diagnostics, and pre-clinical nuclei...",8.135,8.71,7.82,8.6,APDN,1318856,HISTORICAL_PRICES,APDN,,1606830572000,0.9938725490196078,0.9938725490196078,8.6,8.135,8.71,7.82,1318856,8.6,8.135,8.71,7.82,1318856,"Jul 9, 20",0.11500000000000021,0.0143
"July 8, 2020",Turning Point Brands Announces Pricing of Secondary Offering of Two Million Shares of Common Stock by its Significant Stockholders,"Turning Point Brands, Inc. (“TPB” or the “Company”) (NYSE: TPB) today announced the pricing of the previously announced underwritten public offering of 1,800,000 shares of Company common stock by Stan...",26.46,26.58,24.85,24.99,TPB,228686,HISTORICAL_PRICES,TPB,,1616033797000,0.21376146788990827,0.21376146788990827,24.99,26.46,26.58,24.85,228686,24.8945,26.3589,26.4784,24.755,228686,"Jul 8, 20",2.039999999999999,0.0835
"July 8, 2020", Turning Point Brands Announces Preliminary Second Quarter 2020 Results,"Turning Point Brands, Inc. (“TPB” or the “Company”) (NYSE: TPB), a leading provider of Other Tobacco Products (“OTP”) and adult consumer alternatives, today announced preliminary sales results for the...",26.46,26.58,24.85,24.99,TPB,228686,HISTORICAL_PRICES,TPB,,1616033797000,0.21376146788990827,0.21376146788990827,24.99,26.46,26.58,24.85,228686,24.8945,26.3589,26.4784,24.755,228686,"Jul 8, 20",2.039999999999999,0.0835
"July 8, 2020",Turning Point Brands Announces Proposed Secondary Offering of Two Million Shares of Common Stock by its Significant Stockholders,"Turning Point Brands, Inc. (“TPB” or the “Company”) (NYSE: TPB), a leading provider of Other Tobacco Products and adult consumer alternatives, today announced the proposed underwritten public offering...",26.46,26.58,24.85,24.99,TPB,228686,HISTORICAL_PRICES,TPB,,1616033797000,0.21376146788990827,0.21376146788990827,24.99,26.46,26.58,24.85,228686,24.8945,26.3589,26.4784,24.755,228686,"Jul 8, 20",2.039999999999999,0.0835
"July 8, 2020",Moderna Completes Enrollment of Phase 2 Study of its mRNA Vaccine Against COVID-19 (mRNA-1273),"Moderna, Inc., (Nasdaq: MRNA) a clinical stage biotechnology company pioneering messenger RNA (mRNA) therapeutics and vaccines to create a new generation of transformative medicines for patients, toda...",61.58,62.46,59.45,60.79,MRNA,7590861,HISTORICAL_PRICES,MRNA,,1606830572000,1.2698120162182087,1.2698120162182087,60.79,61.58,62.46,59.45,7590861,60.79,61.58,62.46,59.45,7590861,"Jul 8, 20",0.4899999999999949,0.008
"July 8, 2020",Novocure Announces Over 100 Physicians in the U.S. Now Certified to Prescribe Optune Lua™,"Novocure (NASDAQ: NVCR) today announced that over 100 physicians from more than 50 cancer treatment centers in the U.S. are now certified to prescribe Optune Lua, which is approved for the first-line...",60.97,61.1,59.37,59.37,NVCR,856364,HISTORICAL_PRICES,NVCR,,1606830572000,-0.021819348628268884,-0.021819348628268884,59.37,60.97,61.1,59.37,856364,59.37,60.97,61.1,59.37,856364,"Jul 8, 20",1.3900000000000006,0.0233
"July 8, 2020",Concert Pharmaceuticals Receives FDA Breakthrough Therapy Designation for CTP-543 for the Treatment of Alopecia Areata,"Concert Pharmaceuticals, Inc. (NASDAQ: CNCE) today announced that the U.S. Food and Drug Administration (FDA) granted Breakthrough Therapy Designation for the Company’s oral Janus kinase inhibitor, CT...",10.56,11.63,10.19,11.25,CNCE,420699,HISTORICAL_PRICES,CNCE,,1606830572000,0.20410490307867743,0.20410490307867743,11.25,10.56,11.63,10.19,420699,11.25,10.56,11.63,10.19,420699,"Jul 8, 20",0.5700000000000003,0.0571
"July 8, 2020",LYNPARZA® (olaparib) Approved in the EU for Germline BRCA-mutated Metastatic Pancreatic Cancer,"AstraZeneca and Merck (NYSE: MRK), known as MSD outside the United States and Canada, today announced that LYNPARZA has been approved in the European Union (EU) as a monotherapy for the maintenance tr...",77.92,78.9642,77.48,78.63,MRK,7831109,HISTORICAL_PRICES,MRK,,1615519169000,0.14218704192318973,0.14218704192318973,78.63,77.92,78.9642,77.48,7831109,76.776,76.0828,77.1024,75.6532,7831109,"Jul 8, 20",-0.7999999999999972,-0.0102
"July 8, 2020",Merck and Eisai Receive Complete Response Letter for KEYTRUDA® (pembrolizumab) plus LENVIMA® (lenvatinib) Combination as First-Line Treatment for Unresectable Hepatocellular Carcinoma,"Merck (NYSE: MRK), known as MSD outside the United States and Canada, and Eisai today announced that the U.S. Food and Drug Administration (FDA) has issued a Complete Response Letter (CRL) regarding M...",77.92,78.9642,77.48,78.63,MRK,7831109,HISTORICAL_PRICES,MRK,,1615519169000,0.14218704192318973,0.14218704192318973,78.63,77.92,78.9642,77.48,7831109,76.776,76.0828,77.1024,75.6532,7831109,"Jul 8, 20",-0.7999999999999972,-0.0102
"July 8, 2020",Gilead Sciences Presents Survey Findings on PrEP Access and Utilization in the U.S. During COVID-19 Shelter-in-Place Orders,"Gilead Sciences, Inc. (Nasdaq: GILD) today announced data presented at the 23rd International AIDS Conference (AIDS 2020: Virtual) evaluating the impact of COVID-19 shelter-in-place orders (SIPOs) and...",75.61,77,74.93,76.7,GILD,6293450,HISTORICAL_PRICES,GILD,,1615518968000,0.0854148722365777,0.0854148722365777,76.7,75.61,77,74.93,6293450,74.2105,73.1559,74.5008,72.498,6293450,"Jul 8, 20",-0.8100000000000023,-0.0106
"July 7, 2020",INVESTOR ALERT: Law Offices of Howard G. Smith Continues Investigation of Verrica Pharmaceuticals Inc. (VRCA) on Behalf of Investors,"Law Offices of Howard G. Smith continues its investigation on behalf of Verrica Pharmaceuticals Inc. (""Verrica"" or the ""Company"") (NASDAQ: VRCA) investors concerning the Company and its officers’ poss...",9.66,10.397,9.01,10.1,VRCA,179027,HISTORICAL_PRICES,VRCA,,1606830572000,-0.147396293027361,-0.147396293027361,10.1,9.66,10.397,9.01,179027,10.1,9.66,10.397,9.01,179027,"Jul 7, 20",-0.33999999999999986,-0.034
"July 7, 2020",FDA Authorizes Marketing of the IQOS Tobacco Heating System as a Modified Risk Tobacco Product,"Altria Group, Inc. (Altria) (NYSE: MO) announces today that the U.S. Food and Drug Administration (FDA) authorized the marketing of the IQOS tobacco heating system as a modified risk tobacco product w...",39.94,40.24,39.12,39.19,MO,8659898,HISTORICAL_PRICES,MO,,1616552281000,0.16205993599068957,0.16205993599068957,39.19,39.94,40.24,39.12,8659898,37.0052,37.7134,37.9966,36.9391,8659898,"Jul 7, 20",0.3399999999999963,0.0086
"July 7, 2020",研究調查脈搏血氧飽和度儀使用Masimo RRp®讀取兒科患者呼吸率的精度,(美國商業資訊)--Masimo (NASDAQ: MASI)今天發布《肺炎》(Pneumonia)雜誌發表的一項研究結果，該研究中，印度新德里的獨立研究人員調查Rad-G™脈搏血氧飽和度儀搭配Masimo RRp®在兒科患者中的精度，並及閘急診收住患兒展開常規評估時臨床工作者確定的數值進行比較1。RRp提供的呼吸率由脈搏血氧飽和度儀中使用的體積描記法確定。 Alwadhi博士及其同事指出，世界許...,233.89,241.14,233.69,234.34,MASI,586023,HISTORICAL_PRICES,MASI,,1606830572000,0.463550466178587,0.463550466178587,234.34,233.89,241.14,233.69,586023,234.34,233.89,241.14,233.69,586023,"Jul 7, 20",-0.710000000000008,-0.003
"July 7, 2020",研究调查脉搏血氧饱和度仪使用Masimo RRp®读取儿科患者呼吸率的精度,(美国商业资讯)--Masimo (NASDAQ: MASI)今天发布《肺炎》(Pneumonia)杂志发表的一项研究结果，该研究中，印度新德里的独立研究人员调查Rad-G™脉搏血氧饱和度仪搭配Masimo RRp®在儿科患者中的精度，并与门急诊收住患儿开展常规评估时临床工作者确定的数值进行比较1。RRp提供的呼吸率由脉搏血氧饱和度仪中使用的体积描记法确定。 Alwadhi博士及其同事指出，世界许...,233.89,241.14,233.69,234.34,MASI,586023,HISTORICAL_PRICES,MASI,,1606830572000,0.463550466178587,0.463550466178587,234.34,233.89,241.14,233.69,586023,234.34,233.89,241.14,233.69,586023,"Jul 7, 20",-0.710000000000008,-0.003
"July 7, 2020","Gap Inc. Launches B2B Sales for Organizations to Purchase Reusable, Non-Medical Grade Cloth Face Masks","Gap Inc. (NYSE: GPS) today announced it has launched a B2B product program focused on offering large organizations high-quality reusable, non-medical grade cloth face masks* to supply to their employe...",11.97,12.34,11.82,12.29,GPS,16663616,HISTORICAL_PRICES,GPS,,1606830572000,0.33296213808463254,0.33296213808463254,12.29,11.97,12.34,11.82,16663616,12.29,11.97,12.34,11.82,16663616,"Jul 7, 20",-0.5399999999999991,-0.0432
"July 7, 2020",Cerus Corporation Reports Successful Inactivation of SARS-CoV-2 with the INTERCEPT Blood System for Plasma,"Cerus Corporation (Nasdaq:CERS) announced today study results demonstrating that the INTERCEPT Blood System inactivates SARS-CoV-2, the causative agent for COVID-19, in plasma components intended for...",7.12,7.49,6.94,7.21,CERS,4458317,HISTORICAL_PRICES,CERS,,1606830572000,0.7623762376237624,0.7623762376237624,7.21,7.12,7.49,6.94,4458317,7.21,7.12,7.49,6.94,4458317,"Jul 7, 20",0.2599999999999998,0.0379
"July 7, 2020",AtriCure to Announce Second Quarter 2020 Financial Results,"AtriCure, Inc. (Nasdaq: ATRC), a leading innovator in treatments for atrial fibrillation (Afib) and left atrial appendage (LAA) management, today announced that it will release its second quarter 2020...",43.25,47.385,43.075,45.73,ATRC,358009,HISTORICAL_PRICES,ATRC,,1606830572000,0.4690896739130434,0.4690896739130434,45.73,43.25,47.385,43.075,358009,45.73,43.25,47.385,43.075,358009,"Jul 7, 20",-2.950000000000003,-0.0639
"July 7, 2020",Aldeyra Therapeutics Announces New Drug Application (NDA) Development Plans for Dry Eye Disease,"Aldeyra Therapeutics, Inc. (Nasdaq: ALDX) (Aldeyra), a clinical-stage biotechnology company focused on the development of novel therapies with the potential to improve the lives of patients with immun...",4.33,4.6,4.21,4.6,ALDX,1877848,HISTORICAL_PRICES,ALDX,,1606830572000,1.1868686868686869,1.1868686868686869,4.6,4.33,4.6,4.21,1877848,4.6,4.33,4.6,4.21,1877848,"Jul 7, 20",0.33000000000000007,0.0825
"July 7, 2020",LabCorp Launches First Digital COVID-19 Service That Improves the Doctor and Patient Experience,"LabCorp (NYSE: LH) today launched the LabCorp At Home COVID-19 Test Collection Service, the first seamless digital service aimed at helping doctors protect patients by testing them for COVID-19 before...",173.12,174.51,171.745,171.87,LH,991966,HISTORICAL_PRICES,LH,,1606830572000,0.4095424198013354,0.4095424198013354,171.87,173.12,174.51,171.745,991966,171.87,173.12,174.51,171.745,991966,"Jul 7, 20",0.5300000000000011,0.0031
"July 7, 2020","Whole Earth Brands, Inc. Launches New Whole Earth® Allulose Baking Blends and Provides Update on Brand Growth","Whole Earth Brands, Inc. (Nasdaq: FREE), Just in time for the fall baking season, Whole Earth Brands, Inc. is launching new Whole Earth® Allulose Baking Blends. The launch is the latest for Whole Eart...",7.06,7.63,7.06,7.47,FREE,1370097,HISTORICAL_PRICES,FREE,,1606830572000,-0.28614762386248743,-0.28614762386248743,7.47,7.06,7.63,7.06,1370097,7.47,7.06,7.63,7.06,1370097,"Jul 7, 20",-0.3600000000000003,-0.0485
"July 7, 2020",Nemaura Medical Submits PMA Application for sugarBEAT® to U.S. FDA,"Nemaura Medical, Inc. (NASDAQ: NMRD) (“Nemaura” or the “Company”), a medical technology company focused on developing micro-systems-based wearable diagnostic devices and currently commercializing suga...",7.82,9.24,7.8,8.4,NMRD,36882,HISTORICAL_PRICES,NMRD,,1606830572000,0.31649831649831645,0.31649831649831645,8.4,7.82,9.24,7.8,36882,8.4,7.82,9.24,7.8,36882,"Jul 7, 20",-0.29999999999999893,-0.0369
"July 7, 2020",Estudo investiga a precisão da frequência respiratória obtida pela oximetria de pulso em pacientes pediátricos que usam RRp® da Masimo,"Masimo (NASDAQ: MASI) anunciou hoje os resultados de um estudo publicado na Pneumonia no qual pesquisadores independentes em Nova Delhi, Índia, investigaram a precisão do RRp® da Masimo em pacientes p...",233.89,241.14,233.69,234.34,MASI,586023,HISTORICAL_PRICES,MASI,,1606830572000,0.463550466178587,0.463550466178587,234.34,233.89,241.14,233.69,586023,234.34,233.89,241.14,233.69,586023,"Jul 7, 20",-0.710000000000008,-0.003
"July 7, 2020",Studie zur Genauigkeit der durch Pulsoximetrie mit Hilfe von RRp® gemessenen Atemfrequenz an pädiatrischen Patienten,"Masimo (NASDAQ: MASI) gab heute die Ergebnisse einer in Pneumonia veröffentlichten Studie bekannte, bei der unabhängige Forscher in Neu-Delhi, Indien, die Genauigkeit von Masimo RRp® an pädiatrischen...",233.89,241.14,233.69,234.34,MASI,586023,HISTORICAL_PRICES,MASI,,1606830572000,0.463550466178587,0.463550466178587,234.34,233.89,241.14,233.69,586023,234.34,233.89,241.14,233.69,586023,"Jul 7, 20",-0.710000000000008,-0.003
"July 6, 2020",Un estudio investiga la precisión de la frecuencia respiratoria obtenida de la oximetría de pulso en pacientes pediátricos que usan Masimo RRp®,"Masimo (NASDAQ: MASI) anunció hoy los resultados de un estudio publicado en Pneumonia, donde investigadores independientes de Nueva Delhi, India, investigaron la precisión de Masimo RRp® en pacientes...",234.6,238.02,233,233.69,MASI,505293,HISTORICAL_PRICES,MASI,,1606830572000,0.4679932419748451,0.4679932419748451,233.69,234.6,238.02,233,505293,233.69,234.6,238.02,233,505293,"Jul 6, 20",2.8799999999999955,0.0124
"July 6, 2020",Shareholder Alert: Robbins LLP Announces It Is Investigating the Officers and Directors of Verrica Pharmaceuticals Inc. (VRCA) on Behalf of Shareholders,Shareholder rights law firm Robbins LLP announces it is investigating whether certain officers and directors of Verrica Pharmaceuticals Inc. (NYSE: VRCA) violated federal securities laws. Verrica is a...,10,10.6599,10,10.6,VRCA,72134,HISTORICAL_PRICES,VRCA,,1606830572000,-0.11738746690203002,-0.11738746690203002,10.6,10,10.6599,10,72134,10.6,10,10.6599,10,72134,"Jul 6, 20",-0.3000000000000007,-0.0291
"July 6, 2020",Quidel Announces Preliminary Revenue for Second Quarter 2020,"Quidel Corporation (NASDAQ: QDEL) (“Quidel”), a provider of rapid diagnostic testing solutions, cellular-based virology assays and molecular diagnostic systems, announced today that it expects revenue...",235.57,236.7599,226.8,227.5,QDEL,1145150,HISTORICAL_PRICES,QDEL,,1606830572000,1.9194447886974841,1.9194447886974841,227.5,235.57,236.7599,226.8,1145150,227.5,235.57,236.7599,226.8,1145150,"Jul 6, 20",8.530000000000001,0.0376
"July 6, 2020",ADC Therapeutics annonce que l'Agence américaine des produits alimentaires et médicamenteux a levé la suspension clinique partielle dont faisait l’objet l’étude clinique pivot de Phase 2 sur le camidanlumab tésirine,"ADC Therapeutics SA (NYSE:ADCT), une société de biotechnologie spécialisée dans l’oncologie au stade clinique avancé, pionnière du développement et de la mise sur le marché de conjugués anticorps-médi...",48.93,53.61,48.17,52.22,ADCT,113984,HISTORICAL_PRICES,ADCT,,1606830572000,0.6502529510961215,0.6502529510961215,52.22,48.93,53.61,48.17,113984,52.22,48.93,53.61,48.17,113984,"Jul 6, 20",-2.1199999999999974,-0.0415
"July 6, 2020",ADC Therapeutics meldet Aufhebung der teilweisen Unterbrechung der zulassungsrelevanten klinischen Phase-2-Studie mit Camidanlumab-Tesirin durch die US-Zulassungsbehörde FDA,"ADC Therapeutics SA (NYSE:ADCT), ein in der klinischen Forschung tätiges Biotechnologieunternehmen mit Schwerpunkt auf Onkologie und Vorreiter in der Entwicklung und Vermarktung von Antikörper-Wirksto...",48.93,53.61,48.17,52.22,ADCT,113984,HISTORICAL_PRICES,ADCT,,1606830572000,0.6502529510961215,0.6502529510961215,52.22,48.93,53.61,48.17,113984,52.22,48.93,53.61,48.17,113984,"Jul 6, 20",-2.1199999999999974,-0.0415
"July 6, 2020","Notice of Lead Plaintiff Deadline for Shareholders in the Co-Diagnostics, Inc. Class Action Lawsuit","Robbins Geller Rudman & Dowd LLP announces that a class action lawsuit has been filed in the District of Utah on behalf of purchasers of Co-Diagnostics, Inc. (NASDAQ:CODX) securities between Febru...",18.07,19.22,18,19.1,CODX,2332529,HISTORICAL_PRICES,CODX,,1606830572000,1.0167410714285712,1.0167410714285712,19.1,18.07,19.22,18,2332529,19.1,18.07,19.22,18,2332529,"Jul 6, 20",-0.8200000000000003,-0.0434
"July 6, 2020",ADC Therapeutics Announces U.S. Food and Drug Administration Has Lifted Partial Clinical Hold on Pivotal Phase 2 Clinical Trial of Camidanlumab Tesirine,"ADC Therapeutics SA (NYSE:ADCT), a clinical-stage oncology-focused biotechnology company leading the development and commercialization of next-generation antibody drug conjugates (ADCs) with highly po...",48.93,53.61,48.17,52.22,ADCT,113984,HISTORICAL_PRICES,ADCT,,1606830572000,0.6502529510961215,0.6502529510961215,52.22,48.93,53.61,48.17,113984,52.22,48.93,53.61,48.17,113984,"Jul 6, 20",-2.1199999999999974,-0.0415
"July 6, 2020",Verastem Oncology Announces Inducement Grants Under Nasdaq Listing Rule 5635(c)(4),"Verastem, Inc. (Nasdaq:VSTM) (also known as Verastem Oncology), a biopharmaceutical company committed to developing and commercializing new medicines for patients battling cancer, today announced the...",1.61,1.7,1.58,1.69,VSTM,5759824,HISTORICAL_PRICES,VSTM,,1606830572000,-0.29385964912280693,-0.29385964912280693,1.69,1.61,1.7,1.58,5759824,1.69,1.61,1.7,1.58,5759824,"Jul 6, 20",-0.05999999999999983,-0.0359
