date,title,description,close,high,low,open,symbol,volume,id,key,subkey,updated,changeOverTime,marketChangeOverTime,uOpen,uClose,uHigh,uLow,uVolume,fOpen,fClose,fHigh,fLow,fVolume,label,change,changePercent
"June 23, 2020","EQUITY ALERT: Rosen Law Firm Announces Filing of Securities Class Action Lawsuit Against Chembio Diagnostics, Inc. – CEMI","Rosen Law Firm, a global investor rights law firm, announces the filing of a class action lawsuit on behalf of purchasers of the securities of Chembio Diagnostics, Inc. (NASDAQ: CEMI) between March 12...",3.41,3.59,3.36,3.56,CEMI,3013778,HISTORICAL_PRICES,CEMI,,1606830572000,-0.3026584867075664,-0.3026584867075664,3.56,3.41,3.59,3.36,3013778,3.56,3.41,3.59,3.36,3013778,"Jun 23, 20",-0.2599999999999998,-0.0708
"June 23, 2020","CEMI INVESTOR ALERT: Bronstein, Gewirtz & Grossman, LLC Notifies Shareholders of Class Action Against Chembio Diagnostics, Inc. and Encourages Investors to Contact the Firm","Bronstein, Gewirtz & Grossman, LLC notifies investors that a class action lawsuit has been filed against Chembio Diagnostics, Inc. (""Chembio"" or ""the Company"") (NASDAQ: CEMI) and certain of its of...",3.41,3.59,3.36,3.56,CEMI,3013778,HISTORICAL_PRICES,CEMI,,1606830572000,-0.3026584867075664,-0.3026584867075664,3.56,3.41,3.59,3.36,3013778,3.56,3.41,3.59,3.36,3013778,"Jun 23, 20",-0.2599999999999998,-0.0708
"June 23, 2020","Nemaura Medical CEO to Participate in Investor Webinar and Q&A Session on July 7, 2020","Nemaura Medical, Inc. (NASDAQ: NMRD) (“Nemaura” or the “Company”), a medical technology company focused on developing micro-systems-based wearable diagnostic devices and currently commercializing suga...",11.76,15.66,10.8399,15.66,NMRD,187425,HISTORICAL_PRICES,NMRD,,1606830572000,0.9797979797979797,0.9797979797979797,15.66,11.76,15.66,10.8399,187425,15.66,11.76,15.66,10.8399,187425,"Jun 23, 20",-3.620000000000001,-0.2354
"June 23, 2020",Karuna Therapeutics Announces Positive Outcome of End-of-Phase 2 Meeting with the FDA for KarXT for the Treatment of Acute Psychosis in Patients with Schizophrenia,"Karuna Therapeutics, Inc. (NASDAQ: KRTX), an innovative clinical-stage biopharmaceutical company committed to developing novel therapies with the potential to transform the lives of people with disabl...",105.74,107.65,103.5,106.18,KRTX,419656,HISTORICAL_PRICES,KRTX,,1606830572000,0.5782089552238805,0.5782089552238805,106.18,105.74,107.65,103.5,419656,106.18,105.74,107.65,103.5,419656,"Jun 23, 20",1.6999999999999886,0.0163
"June 22, 2020",Verastem Oncology Announces Presentation of Preclinical Data Supporting the Combination of VS-6766 and Defactinib in Metastatic Uveal Melanoma,"Verastem, Inc. (Nasdaq:VSTM) (also known as Verastem Oncology), a biopharmaceutical company committed to developing and commercializing new medicines for patients battling cancer, today announced resu...",1.85,1.88,1.76,1.8,VSTM,6099698,HISTORICAL_PRICES,VSTM,,1606830572000,-0.18859649122807007,-0.18859649122807007,1.8,1.85,1.88,1.76,6099698,1.8,1.85,1.88,1.76,6099698,"Jun 22, 20",0.050000000000000044,0.0278
"June 22, 2020","SHAREHOLDER ACTION REMINDER: The Schall Law Firm Announces the Filing of a Class Action Lawsuit Against Chembio Diagnostics, Inc. and Encourages Investors with Losses in Excess of $100,000 to Contact the Firm","The Schall Law Firm, a national shareholder rights litigation firm, announces the filing of a class action lawsuit against Chembio Diagnostics, Inc. (“Chembio” or “the Company”) (NASDAQ: CEMI) for vio...",3.67,3.73,3.245,3.54,CEMI,6484194,HISTORICAL_PRICES,CEMI,,1606830572000,-0.24948875255623718,-0.24948875255623718,3.54,3.67,3.73,3.245,6484194,3.54,3.67,3.73,3.245,6484194,"Jun 22, 20",0.1200000000000001,0.0338
"June 22, 2020",Everbridge Recognized as One of The Fastest-Growing Public Companies in Massachusetts,"Everbridge, Inc. (NASDAQ: EVBG), the global leader in Critical Event Management (CEM), today announced its recognition on the 2020 Boston Business Journal list of Fastest-Growing Public Companies in M...",134.29,135.32,130,131,EVBG,394885,HISTORICAL_PRICES,EVBG,,1606830572000,0.21342730640643345,0.21342730640643345,131,134.29,135.32,130,394885,131,134.29,135.32,130,394885,"Jun 22, 20",4.1699999999999875,0.032
"June 22, 2020",Pfizer Announces Start of Four Phase 3 Clinical Trials for Investigational Vaccines,Pfizer Inc. (NYSE:PFE) today announced the initiation of four Phase 3 clinical trials within its current pipeline of investigational vaccines: Two studies (NCT04382326 and NCT04379713) of the 20-valen...,33.11,33.36,32.91,33.33,PFE,22137128,HISTORICAL_PRICES,PFE,,1611800358000,0.11294117647058821,0.11294117647058821,33.33,33.11,33.36,32.91,22137128,32.3198,32.1065,32.3489,31.9125,22137128,"Jun 22, 20",-0.3100000000000023,-0.0093
"June 22, 2020","Seres Therapeutics Appoints Terri Young, Ph.D., R.Ph., Experienced Commercial Leader, as Executive Vice President, Chief Commercial and Strategy Officer","Seres Therapeutics, Inc. (Nasdaq: MCRB) today announced the appointment of Terri Young, Ph.D., R.Ph., as Executive Vice President, Chief Commercial and Strategy Officer, effective June 29, 2020. Dr. Y...",4.86,5.02,4.62,4.81,MCRB,559975,HISTORICAL_PRICES,MCRB,,1606830572000,0.41690962099125367,0.41690962099125367,4.81,4.86,5.02,4.62,559975,4.81,4.86,5.02,4.62,559975,"Jun 22, 20",0.0600000000000005,0.0125
"June 22, 2020",Deciphera Announces Health Canada’s Authorization of QINLOCK™ (ripretinib) for the Treatment of Fourth-Line Gastrointestinal Stromal Tumor,"Deciphera Pharmaceuticals, Inc. (NASDAQ:DCPH) today announced that Health Canada has authorized QINLOCK™ (ripretinib), a switch-control tyrosine kinase inhibitor, for sale in Canada for the treatment...",65.03,65.58,61.91,62.52,DCPH,708645,HISTORICAL_PRICES,DCPH,,1606830572000,0.5730527334300918,0.5730527334300918,62.52,65.03,65.58,61.91,708645,62.52,65.03,65.58,61.91,708645,"Jun 22, 20",2.3100000000000023,0.0368
"June 22, 2020",Lantheus Completes Merger with Progenics,"Lantheus Holdings, Inc. (the “Company”) (NASDAQ: LNTH), the parent company of Lantheus Medical Imaging, Inc. (“LMI”), a global leader in the development, manufacture and commercialization of innovativ...",13.98,14.5,13.499,14.44,LNTH,1534412,HISTORICAL_PRICES,LNTH,,1606830572000,0.21989528795811514,0.21989528795811514,14.44,13.98,14.5,13.499,1534412,14.44,13.98,14.5,13.499,1534412,"Jun 22, 20",-0.8499999999999996,-0.0573
"June 22, 2020","Merck Announces That V114, Its Investigational 15-valent Pneumococcal Conjugate Vaccine, Met Safety and Immunogenicity Objectives in Initial Phase 3 Studies in Adults","Merck (NYSE: MRK), known as MSD outside the United States and Canada, today announced results from two initial Phase 3 studies evaluating the safety, tolerability and immunogenicity of V114, the compa...",76.75,77.63,76.43,77.37,MRK,7131940,HISTORICAL_PRICES,MRK,,1615519017000,0.12503664614482557,0.12503664614482557,77.37,76.75,77.63,76.43,7131940,75.5458,74.9404,75.7996,74.6279,7131940,"Jun 22, 20",-1.1500000000000057,-0.0148
"June 22, 2020",Merck’s KEYTRUDA® (pembrolizumab) Approved in China for Second-Line Treatment of Patients with Locally Advanced or Metastatic Esophageal Squamous Cell Carcinoma Whose Tumors Express PD-L1 (CPS ≥10),"Merck (NYSE: MRK), known as MSD outside the United States and Canada, today announced that KEYTRUDA, Merck’s anti-PD-1 therapy, has been approved by the National Medical Products Administration (NMPA)...",76.75,77.63,76.43,77.37,MRK,7131940,HISTORICAL_PRICES,MRK,,1615519017000,0.12503664614482557,0.12503664614482557,77.37,76.75,77.63,76.43,7131940,75.5458,74.9404,75.7996,74.6279,7131940,"Jun 22, 20",-1.1500000000000057,-0.0148
"June 19, 2020","SHAREHOLDER ACTION ALERT: The Schall Law Firm Announces the Filing of a Class Action Lawsuit Against Chembio Diagnostics, Inc. and Encourages Investors with Losses in Excess of $100,000 to Contact the Firm","The Schall Law Firm, a national shareholder rights litigation firm, announces the filing of a class action lawsuit against Chembio Diagnostics, Inc. (“Chembio” or “the Company”) (NASDAQ: CEMI) for vio...",3.55,3.83,3.53,3.77,CEMI,7133916,HISTORICAL_PRICES,CEMI,,1606830572000,-0.2740286298568507,-0.2740286298568507,3.77,3.55,3.83,3.53,7133916,3.77,3.55,3.83,3.53,7133916,"Jun 19, 20",-0.20500000000000007,-0.0546
"June 19, 2020","INVESTOR ALERT: Law Offices of Howard G. Smith Announces the Filing of a Securities Class Action on Behalf of Co-Diagnostics, Inc. (CODX) Investors","Law Offices of Howard G. Smith announces that a class action lawsuit has been filed on behalf of investors who purchased Co-Diagnostics, Inc. (""Co-Diagnostics"" or the ""Company"") (NASDAQ: CODX) securit...",17.24,17.8,15.82,15.95,CODX,3213618,HISTORICAL_PRICES,CODX,,1606830572000,0.9241071428571425,0.9241071428571425,15.95,17.24,17.8,15.82,3213618,15.95,17.24,17.8,15.82,3213618,"Jun 19, 20",1.3099999999999987,0.0822
"June 19, 2020",Masimo Announces Masimo SafetyNet-Open™,"Masimo (NASDAQ: MASI) today announced Masimo SafetyNet-Open™, designed to help businesses, governments, and schools more responsibly manage employee and student health and safety during COVID-19. As t...",226.03,226.87,220.3525,223.13,MASI,878581,HISTORICAL_PRICES,MASI,,1606830572000,0.4143670608848007,0.4143670608848007,223.13,226.03,226.87,220.3525,878581,223.13,226.03,226.87,220.3525,878581,"Jun 19, 20",4.6200000000000045,0.0209
"June 19, 2020","Masimo Announces Masimo Sleep™, a New Wellness Solution That Allows Users to Better Understand Their Sleep Quality","Masimo (NASDAQ: MASI) announced today a new health and wellness home monitoring solution, Masimo Sleep™, designed to help consumers better understand the quality of their sleep. Masimo Sleep is fueled...",226.03,226.87,220.3525,223.13,MASI,878581,HISTORICAL_PRICES,MASI,,1606830572000,0.4143670608848007,0.4143670608848007,223.13,226.03,226.87,220.3525,878581,223.13,226.03,226.87,220.3525,878581,"Jun 19, 20",4.6200000000000045,0.0209
"June 18, 2020","INVESTOR ALERT: Law Offices of Howard G. Smith Announces the Filing of a Securities Class Action on Behalf of Chembio Diagnostics, Inc. (CEMI) Investors","Law Offices of Howard G. Smith announces that a class action lawsuit has been filed on behalf of investors who purchased Chembio Diagnostics, Inc. (""Chembio"" or the ""Company"") (NASDAQ: CEMI) common st...",3.755,4.3,3.73,3.98,CEMI,13968644,HISTORICAL_PRICES,CEMI,,1606830572000,-0.23210633946830264,-0.23210633946830264,3.98,3.755,4.3,3.73,13968644,3.98,3.755,4.3,3.73,13968644,"Jun 18, 20",-0.13500000000000023,-0.0347
"June 18, 2020","The Law Offices of Frank R. Cruz Announces Investigation on Behalf of Chembio Diagnostics, Inc. Investors (CEMI)","The Law Offices of Frank R. Cruz announces an investigation on behalf of Chembio Diagnostics, Inc. (""Chembio"" or the ""Company"") (NASDAQ: CEMI) investors concerning the Company and its officers’ possib...",3.755,4.3,3.73,3.98,CEMI,13968644,HISTORICAL_PRICES,CEMI,,1606830572000,-0.23210633946830264,-0.23210633946830264,3.98,3.755,4.3,3.73,13968644,3.98,3.755,4.3,3.73,13968644,"Jun 18, 20",-0.13500000000000023,-0.0347
"June 18, 2020",Urovant Sciences Reports Fiscal Year and Fourth Quarter 2019 Results,"Urovant Sciences (Nasdaq: UROV) today reported financial results for the three months and 2019 fiscal year ended March 31, 2020. The fiscal fourth quarter of 2019 marked achievement of key milestones...",11.5,12.06,10.95,11,UROV,78088,HISTORICAL_PRICES,UROV,,1606830572000,0.14427860696517406,0.14427860696517406,11,11.5,12.06,10.95,78088,11,11.5,12.06,10.95,78088,"Jun 18, 20",0.5600000000000005,0.0512
"June 18, 2020",Shareholder Alert: Robbins LLP Announces Co-Diagnostics Inc. (CODX) Sued for Misleading Shareholders,Shareholder rights law firm Robbins LLP announces that a purchaser of Co-Diagnostics Inc. (NASDAQ: CODX) filed a class action complaint against the Company for alleged violations of the Securities Exc...,15.93,16.57,15.7752,16.15,CODX,1971992,HISTORICAL_PRICES,CODX,,1606830572000,0.7779017857142855,0.7779017857142855,16.15,15.93,16.57,15.7752,1971992,16.15,15.93,16.57,15.7752,1971992,"Jun 18, 20",-0.5800000000000018,-0.0351
"June 18, 2020", Epizyme Announces U.S. FDA Accelerated Approval of TAZVERIK™ (tazemetostat) for Relapsed/Refractory Follicular Lymphoma,"Epizyme, Inc. (Nasdaq:EPZM), a fully integrated, commercial-stage biopharmaceutical company developing novel epigenetic therapies, today announced that the U.S. Food and Drug Administration (FDA) has...",20.46,22,18.02,19.7,EPZM,6255850,HISTORICAL_PRICES,EPZM,,1606830572000,0.3487145682267634,0.3487145682267634,19.7,20.46,22,18.02,6255850,19.7,20.46,22,18.02,6255850,"Jun 18, 20",0.9400000000000013,0.0482
"June 18, 2020","INVESTOR ALERT: Law Offices of Howard G. Smith Announces Investigation of Chembio Diagnostics, Inc. (CEMI) on Behalf of Investors","Law Offices of Howard G. Smith announces an investigation on behalf of Chembio Diagnostics, Inc. (""Chembio"" or the ""Company"") (NASDAQ: CEMI) investors concerning the Company and its officers’ possible...",3.755,4.3,3.73,3.98,CEMI,13968644,HISTORICAL_PRICES,CEMI,,1606830572000,-0.23210633946830264,-0.23210633946830264,3.98,3.755,4.3,3.73,13968644,3.98,3.755,4.3,3.73,13968644,"Jun 18, 20",-0.13500000000000023,-0.0347
"June 18, 2020",TFF Pharmaceuticals Receives Orphan Drug Designation for Tacrolimus Inhalation Powder,"TFF Pharmaceuticals, Inc. (NASDAQ: TFFP), a clinical-stage biopharmaceutical company focused on developing and commercializing innovative drug products based on its patented Thin Film Freezing (TFF) t...",6.02,6.24,5.91,6.1,TFFP,168482,HISTORICAL_PRICES,TFFP,,1606830572000,0.5049999999999999,0.5049999999999999,6.1,6.02,6.24,5.91,168482,6.1,6.02,6.24,5.91,168482,"Jun 18, 20",-0.0600000000000005,-0.0099
"June 18, 2020",Xeris Pharmaceuticals Announces Positive Topline Results from the Phase 2 Comparative Study of a Novel Pramlintide-insulin Co-formulation (XP-3924) in Adults with Type 1 Diabetes Mellitus,"Xeris Pharmaceuticals, Inc. (Nasdaq: XERS), a specialty pharmaceutical company leveraging its novel technology platforms to develop and commercialize ready-to-use injectable and infusible drug formula...",5.49,5.67,5.18,5.2,XERS,411288,HISTORICAL_PRICES,XERS,,1606830572000,1.920212765957447,1.920212765957447,5.2,5.49,5.67,5.18,411288,5.2,5.49,5.67,5.18,411288,"Jun 18, 20",0.33000000000000007,0.064
"June 18, 2020",Urovant Sciences Announces Collaboration with Sunovion Pharmaceuticals,Urovant Sciences (Nasdaq: UROV) today announced it has entered into an exclusive three-year distribution agreement with Sunovion Pharmaceuticals Inc. (Sunovion) for services to support the commerciali...,11.5,12.06,10.95,11,UROV,78088,HISTORICAL_PRICES,UROV,,1606830572000,0.14427860696517406,0.14427860696517406,11,11.5,12.06,10.95,78088,11,11.5,12.06,10.95,78088,"Jun 18, 20",0.5600000000000005,0.0512
"June 18, 2020",Dicerna Receives Rare Pediatric Disease Designation From U.S. Food and Drug Administration for Nedosiran for Treatment of Primary Hyperoxaluria,"Dicerna Pharmaceuticals, Inc. (Nasdaq: DRNA) (the “Company” or “Dicerna”), a leading developer of investigational ribonucleic acid interference (RNAi) therapeutics, today announced that the U.S. Food...",24.56,24.73,23.04,23.15,DRNA,568116,HISTORICAL_PRICES,DRNA,,1606830572000,0.3636868406440864,0.3636868406440864,23.15,24.56,24.73,23.04,568116,23.15,24.56,24.73,23.04,568116,"Jun 18, 20",1.2699999999999996,0.0545
"June 18, 2020",Neurocrine Biosciences和武田宣布合作开发和商业化精神疾病潜在治疗药物,"(美国商业资讯)--Neurocrine Biosciences, Inc. (Nasdaq:NBIX)和武田药品工业株式会社(Takeda Pharmaceutical Company Limited, TSE:4502/NYSE:TAK)（“武田”）今天宣布一项旨在开发和商业化武田早期至中期精神科产品管线的战略合作。具体而言，武田向Neurocrine Biosciences排他性授权七个管线...",121.03,121.47,118.41,118.41,NBIX,530957,HISTORICAL_PRICES,NBIX,,1606830572000,0.34134988363072144,0.34134988363072144,118.41,121.03,121.47,118.41,530957,118.41,121.03,121.47,118.41,530957,"Jun 18, 20",1.7600000000000051,0.0148
"June 18, 2020",Neurocrine Biosciences和武田宣佈合作開發精神疾病潛在治療藥物並進行商業化,"(美國商業資訊)--Neurocrine Biosciences, Inc. (Nasdaq:NBIX)和武田藥品工業株式會社(Takeda Pharmaceutical Company Limited, TSE:4502/NYSE:TAK)（「武田」）今天宣佈策略性合作，旨在開發武田早期至中期精神科產品線並進行商業化。具體而言，武田對Neurocrine Biosciences提供七個產品線計畫...",121.03,121.47,118.41,118.41,NBIX,530957,HISTORICAL_PRICES,NBIX,,1606830572000,0.34134988363072144,0.34134988363072144,118.41,121.03,121.47,118.41,530957,118.41,121.03,121.47,118.41,530957,"Jun 18, 20",1.7600000000000051,0.0148
"June 17, 2020","Abiomed lance un programme d’éducation médicale en ligne, CAMP PCI, afin d’améliorer les résultats pour les patients subissant une ICP à haut risque","Aujourd’hui, Abiomed (NASDAQ: ABMD) a lancé sa plateforme d’éducation numérique ultra-moderne CAMP PCI, qui signifie en anglais Coronary Artery & Myocardial Protected Percutaneous Coronary Interve...",254.73,256,249.153,252.04,ABMD,381594,HISTORICAL_PRICES,ABMD,,1606830572000,0.7341548097215604,0.7341548097215604,252.04,254.73,256,249.153,381594,252.04,254.73,256,249.153,381594,"Jun 17, 20",5.590000000000003,0.0224
"June 17, 2020",Tandem Diabetes Care Announces Expanded Pediatric Indication of the t:slim X2 Insulin Pump with Control-IQ Advanced Hybrid Closed-Loop Technology,"Tandem Diabetes Care, Inc. (NASDAQ: TNDM), a leading insulin delivery and diabetes technology company, today announced U.S. Food and Drug Administration (FDA) clearance of an expanded pediatric indica...",86.71,89.53,80.51,81.34,TNDM,3140075,HISTORICAL_PRICES,TNDM,,1606830572000,0.5079999999999999,0.5079999999999999,81.34,86.71,89.53,80.51,3140075,81.34,86.71,89.53,80.51,3140075,"Jun 17, 20",5.319999999999993,0.0654
"June 17, 2020",Clovis Oncology to Highlight Rubraca® (rucaparib) and Lucitanib Non-Clinical Data at the AACR Virtual Annual Meeting II 2020,"Clovis Oncology, Inc. (NASDAQ: CLVS) announced today that four abstracts showcasing non-clinical data from rucaparib and lucitanib development programs have been accepted for on-demand viewing and pub...",6.965,7.41,6.92,7.25,CLVS,3524171,HISTORICAL_PRICES,CLVS,,1606830572000,0.572234762979684,0.572234762979684,7.25,6.965,7.41,6.92,3524171,7.25,6.965,7.41,6.92,3524171,"Jun 17, 20",-0.3849999999999998,-0.0524
"June 17, 2020","FDA Approves Second Biomarker-Based Indication for Merck’s KEYTRUDA® (pembrolizumab), Regardless of Tumor Type","Merck (NYSE: MRK), known as MSD outside the United States and Canada, today announced that the U.S. Food and Drug Administration (FDA) has approved KEYTRUDA, Merck’s anti-PD-1 therapy, as monotherapy...",76.29,77.45,75.625,77.36,MRK,13342640,HISTORICAL_PRICES,MRK,,1615519069000,0.11829375549692184,0.11829375549692184,77.36,76.29,77.45,75.625,13342640,75.536,74.4912,75.6239,73.8419,13342640,"Jun 17, 20",-0.6799999999999926,-0.0088
"June 17, 2020",ChromaDex Research & Development Facility Earns ISO/IEC 17025:2017 Accreditation,"ChromaDex Corp. (NASDAQ:CDXC) announced today it has achieved ISO/IEC 17025:2017 quality standard for laboratory testing, the world’s most respected quality management standard. This accreditation cov...",4.25,4.4,4.22,4.39,CDXC,144521,HISTORICAL_PRICES,CDXC,,1606830572000,0.44067796610169485,0.44067796610169485,4.39,4.25,4.4,4.22,144521,4.39,4.25,4.4,4.22,144521,"Jun 17, 20",-0.11000000000000032,-0.0252
"June 16, 2020","Abiomed führt das virtuelle Fortbildungsprogamm CAMP PCI für Ärzte ein, um die Ergebnisse bei Hochrisiko-PCI-Patienten zu verbessern","Heute führte Abiomed (NASDAQ: ABMD), eine hochmoderne Ausbildungsplattform unter dem Namen CAMP PCI ein. Dies steht für „Coronary Artery & Myocardial Protected Percutaneous Coronary Intervention”,...",249.14,252.49,246.295,252.49,ABMD,419003,HISTORICAL_PRICES,ABMD,,1606830572000,0.6960991217918171,0.6960991217918171,252.49,249.14,252.49,246.295,419003,252.49,249.14,252.49,246.295,419003,"Jun 16, 20",2.809999999999974,0.0114
"June 16, 2020",Neurocrine Biosciences und Takeda kündigen Zusammenarbeit bei der Entwicklung und Vermarktung möglicher Therapien für psychische Störungen an,"Neurocrine Biosciences, Inc. (Nasdaq:NBIX) und die Takeda Pharmaceutical Company Limited (TSE:4502/NYSE:TAK) („Takeda”) gaben heute eine strategische Zusammenarbeit bei der Entwicklung und Vermarktung...",118.89,119.42,114.75,117.72,NBIX,778445,HISTORICAL_PRICES,NBIX,,1606830572000,0.317632716391444,0.317632716391444,117.72,118.89,119.42,114.75,778445,117.72,118.89,119.42,114.75,778445,"Jun 16, 20",3.5600000000000023,0.0309
"June 16, 2020",Neurocrine Biosciences et Takeda annoncent une collaboration pour le développement et la mise sur le marché de thérapies potentielles contre les troubles psychiatriques,"Neurocrine Biosciences, Inc. (Nasdaq:NBIX) et Takeda Pharmaceutical Company Limited (TSE:4502/NYSE:TAK) (« Takeda ») annoncent ce jour une collaboration stratégique pour le développement et la mise su...",118.89,119.42,114.75,117.72,NBIX,778445,HISTORICAL_PRICES,NBIX,,1606830572000,0.317632716391444,0.317632716391444,117.72,118.89,119.42,114.75,778445,117.72,118.89,119.42,114.75,778445,"Jun 16, 20",3.5600000000000023,0.0309
"June 16, 2020",Merck and Pfizer’s SGLT2 Inhibitor STEGLATROTM (ertugliflozin) Meets Primary Endpoint in VERTIS CV Trial for Patients with Type 2 Diabetes and Atherosclerotic Cardiovascular Disease,"Merck (NYSE: MRK), known as MSD outside the United States and Canada, and Pfizer Inc. (NYSE:PFE), today announced the presentation of results from the Phase 3 VERTIS CV cardiovascular (CV) outcomes tr...",76.97,77.41,74.83,75.38,MRK,20460690,HISTORICAL_PRICES,MRK,,1615519138000,0.12826150688947524,0.12826150688947524,75.38,76.97,77.41,74.83,20460690,73.6027,75.1552,75.5848,73.0656,20460690,"Jun 16, 20",2.950000000000003,0.0399
"June 16, 2020",Neurocrine Biosciences y Takeda anuncian una colaboración para desarrollar y comercializar posibles tratamientos para trastornos psiquiátricos,"Neurocrine Biosciences, Inc. (Nasdaq:NBIX) y Takeda Pharmaceutical Company Limited (TSE:4502/NYSE:TAK) («Takeda») acaban de anunciar una colaboración estratégica para desarrollar y comercializar compu...",118.89,119.42,114.75,117.72,NBIX,778445,HISTORICAL_PRICES,NBIX,,1606830572000,0.317632716391444,0.317632716391444,117.72,118.89,119.42,114.75,778445,117.72,118.89,119.42,114.75,778445,"Jun 16, 20",3.5600000000000023,0.0309
"June 16, 2020",Neurocrine Biosciences e Takeda anunciam colaboração para desenvolver e comercializar potenciais terapias para distúrbios psiquiátricos,"A Neurocrine Biosciences, Inc. (Nasdaq:NBIX) e a Takeda Pharmaceutical Company Limited (TSE:4502/NYSE:TAK) (“Takeda”) anunciaram hoje uma colaboração estratégica para desenvolver e comercializar produ...",118.89,119.42,114.75,117.72,NBIX,778445,HISTORICAL_PRICES,NBIX,,1606830572000,0.317632716391444,0.317632716391444,117.72,118.89,119.42,114.75,778445,117.72,118.89,119.42,114.75,778445,"Jun 16, 20",3.5600000000000023,0.0309
"June 16, 2020",Abiomed ernennt Dr. med. Charles Simonton zum neuen Chief Medical Officer,"Abiomed (Nasdaq: ABMD), Hersteller der Impella Herzpumpe, gab heute die Ernennung von Dr. med. Charles (Chuck) Simonton zum Vice President und Chief Medical Officer bekannt. Dr. Simonton ist für seine...",249.14,252.49,246.295,252.49,ABMD,419003,HISTORICAL_PRICES,ABMD,,1606830572000,0.6960991217918171,0.6960991217918171,252.49,249.14,252.49,246.295,419003,252.49,249.14,252.49,246.295,419003,"Jun 16, 20",2.809999999999974,0.0114
"June 16, 2020",Genprex Expands Manufacturing Program with Aldevron to Advance Oncoprex™ Clinical Development,"Genprex, Inc. (“Genprex” or the “Company”) (Nasdaq: GNPX), a clinical-stage gene therapy company developing potentially life-changing technologies for patients with cancer and diabetes, announced toda...",3,3.12,2.91,3.09,GNPX,1280518,HISTORICAL_PRICES,GNPX,,1606830572000,0.07526881720430106,0.07526881720430106,3.09,3,3.12,2.91,1280518,3.09,3,3.12,2.91,1280518,"Jun 16, 20",-0.020000000000000018,-0.0066
"June 16, 2020",Neurocrine Biosciences and Takeda Announce Collaboration to Develop and Commercialize Potential Therapies for Psychiatric Disorders,"Neurocrine Biosciences, Inc. (Nasdaq:NBIX) and Takeda Pharmaceutical Company Limited (TSE:4502/NYSE:TAK) (“Takeda”) today announced a strategic collaboration to develop and commercialize compounds in...",118.89,119.42,114.75,117.72,NBIX,778445,HISTORICAL_PRICES,NBIX,,1606830572000,0.317632716391444,0.317632716391444,117.72,118.89,119.42,114.75,778445,117.72,118.89,119.42,114.75,778445,"Jun 16, 20",3.5600000000000023,0.0309
"June 16, 2020","Abiomed Launches Virtual Physician Education Program, CAMP PCI, to Improve High-Risk PCI Patient Outcomes","Today, Abiomed (NASDAQ: ABMD) launches a cutting-edge digital education platform called CAMP PCI, which stands for Coronary Artery & Myocardial Protected Percutaneous Coronary Intervention, to imp...",249.14,252.49,246.295,252.49,ABMD,419003,HISTORICAL_PRICES,ABMD,,1606830572000,0.6960991217918171,0.6960991217918171,252.49,249.14,252.49,246.295,419003,252.49,249.14,252.49,246.295,419003,"Jun 16, 20",2.809999999999974,0.0114
