date,ticker,pct_change_prev_close,day_percent_change,max_day_percent_change,source,title,description,url,same_or_prev
3/24/20,NYMT,-46,-21.53846154,0.769230769,gnw,"New York Mortgage Trust Provides Update on Status of Financing Arrangements as of March 23, 2020","NEW YORK, March 23, 2020 (GLOBE NEWSWIRE) -- New York Mortgage Trust, Inc. (Nasdaq: NYMT) (the “Company”) announced today that due to the turmoil in the financial markets resulting from the global...",https://www.globenewswire.com/news-release/2020/03/24/2005152/12581/en/New-York-Mortgage-Trust-Provides-Update-on-Status-of-Financing-Arrangements-as-of-March-23-2020.html,prev
3/24/20,BXRX,-48.1,-24.08026756,0,gnw,Baudax Bio Announces Pricing of Public Offering of Common Stock and Warrants,"MALVERN, Pa., March 24, 2020 (GLOBE NEWSWIRE) -- Baudax Bio, Inc. (“Baudax” or the “Company”) (Nasdaq: BXRX), a pharmaceutical company focused on therapeutics for acute care settings, today...",https://www.globenewswire.com/news-release/2020/03/24/2005589/0/en/Baudax-Bio-Announces-Pricing-of-Public-Offering-of-Common-Stock-and-Warrants.html,same
3/24/20,BXRX,-48.1,-24.08026756,0,gnw,Baudax Bio Announces Proposed Public Offering of Common Stock and Warrants,"MALVERN, Pa., March 23, 2020 (GLOBE NEWSWIRE) -- Baudax Bio, Inc. (“Baudax” or the “Company”) (Nasdaq: BXRX), a pharmaceutical company focused on therapeutics for acute care settings, today...",https://www.globenewswire.com/news-release/2020/03/23/2005075/0/en/Baudax-Bio-Announces-Proposed-Public-Offering-of-Common-Stock-and-Warrants.html,prev
3/25/20,IMAC,-54.9,-29.20634921,11.11111111,gnw,IMAC Launches New Telehealth Options to Maintain Consistent Communications with Active Care Patients Choosing to “Shelter in Place”,"BRENTWOOD, Tenn, March 24, 2020 (GLOBE NEWSWIRE) -- IMAC Holdings, Inc. (Nasdaq: IMAC) (the “Company” or “IMAC”), a provider of innovative medical advancements and care specializing in regenerative...",https://www.globenewswire.com/news-release/2020/03/24/2005464/0/en/IMAC-Launches-New-Telehealth-Options-to-Maintain-Consistent-Communications-with-Active-Care-Patients-Choosing-to-Shelter-in-Place.html,prev
3/31/20,MOHO,-46.4,-45.38461539,3.221153846,gnw,CORRECTION: ECMOHO Announces Fourth Quarter 2019 and Full Year 2019 Preliminary Unaudited Selected Financial Data,"SHANGHAI, China, March 30, 2020 (GLOBE NEWSWIRE) -- In a release issued under the same headline on Monday, March 30th by ECMOHO Limited (Nasdaq: MOHO), please note that in the 7th bullet of the 2019...",https://www.globenewswire.com/news-release/2020/03/30/2008578/0/en/CORRECTION-ECMOHO-Announces-Fourth-Quarter-2019-and-Full-Year-2019-Preliminary-Unaudited-Selected-Financial-Data.html,prev
3/31/20,MOHO,-46.4,-45.38461539,3.221153846,gnw,ECMOHO and China Resources Ng Fung Enter into Strategic Partnership in the Sale of High Quality Food,"SHANGHAI, China, March 30, 2020 (GLOBE NEWSWIRE) -- ECMOHO Limited (""ECMOHO"" or the ""Company""; Nasdaq: MOHO) and China Resources Ng Fung, a member of the China Resources Group, have entered into a...",https://www.globenewswire.com/news-release/2020/03/30/2008572/0/en/ECMOHO-and-China-Resources-Ng-Fung-Enter-into-Strategic-Partnership-in-the-Sale-of-High-Quality-Food.html,prev
3/31/20,MOHO,-46.4,-45.38461539,3.221153846,gnw,ECMOHO Announces Fourth Quarter 2019 and Full Year 2019 Preliminary Unaudited Selected Financial Data,"SHANGHAI, China, March 30, 2020 (GLOBE NEWSWIRE) -- ECMOHO Limited (Nasdaq: MOHO) (“ECMOHO” or the “Company”), a leading integrated solutions provider in the rapidly growing non-medical health and...",https://www.globenewswire.com/news-release/2020/03/30/2008524/0/en/ECMOHO-Announces-Fourth-Quarter-2019-and-Full-Year-2019-Preliminary-Unaudited-Selected-Financial-Data.html,prev
4/1/20,CATM,-23.9,-20.27027027,0,gnw,Cardtronics Provides COVID-19-Related Business Update,"HOUSTON, April 01, 2020 (GLOBE NEWSWIRE) -- Cardtronics plc (Nasdaq: CATM) (“Cardtronics” or the “Company”), the world’s largest ATM owner/operator, today announced business updates in connection...",https://www.globenewswire.com/news-release/2020/04/01/2009937/3269/en/Cardtronics-Provides-COVID-19-Related-Business-Update.html,same
4/1/20,MRLN,-23.4,-20.22367195,4.753028891,gnw,Marlin Announces Relief From Capital Maintenance and Liquidity Agreement,"MOUNT LAUREL, N.J., March 31, 2020 (GLOBE NEWSWIRE) -- Marlin Business Services Corp. (NASDAQ: MRLN), a nationwide provider of capital solutions to small businesses (“Marlin” or the “Company”),...",https://www.globenewswire.com/news-release/2020/03/31/2009191/8557/en/Marlin-Announces-Relief-From-Capital-Maintenance-and-Liquidity-Agreement.html,prev
4/3/20,NCSM,-30,-22.98,32.2,gnw,"NCS Multistage Holdings, Inc. Announces First Quarter 2020 Operational Update","HOUSTON, April 02, 2020 (GLOBE NEWSWIRE) -- NCS Multistage Holdings, Inc. (the “Company,” “NCS,” “we” or “us”) (NASDAQ:NCSM) today announced immediate actions taken in response to current global...",https://www.globenewswire.com/news-release/2020/04/02/2011103/0/en/NCS-Multistage-Holdings-Inc-Announces-First-Quarter-2020-Operational-Update.html,prev
4/3/20,WRLS,-61.5,-61.78343949,0,gnw,"Pensare Acquisition Corp. Announces Intent to Close Initial Business Combination with Stratos Management Systems, Inc. on or about April 6, 2020","ATLANTA, April 03, 2020 (GLOBE NEWSWIRE) -- Pensare Acquisition Corp. (Nasdaq: WRLS, WRLSU, WRLSW, WRLSR) (the “Company”) today announced that it intends to close the previously announced business...",https://www.globenewswire.com/news-release/2020/04/03/2011496/0/en/Pensare-Acquisition-Corp-Announces-Intent-to-Close-Initial-Business-Combination-with-Stratos-Management-Systems-Inc-on-or-about-April-6-2020.html,same
4/7/20,MNLO,-26.4,-31.33333333,0.66,gnw,Menlo Therapeutics Announces Results from Two Phase 3 Clinical Trials of Serlopitant for the Treatment of Pruritus Associated with Prurigo Nodularis,"BRIDGEWATER, N.J., April 06, 2020 (GLOBE NEWSWIRE) -- Menlo Therapeutics Inc. (Nasdaq: MNLO) (“Menlo” or the “Company”), a biopharmaceutical company focused on developing and commercializing...",https://www.globenewswire.com/news-release/2020/04/06/2012003/0/en/Menlo-Therapeutics-Announces-Results-from-Two-Phase-3-Clinical-Trials-of-Serlopitant-for-the-Treatment-of-Pruritus-Associated-with-Prurigo-Nodularis.html,prev
4/7/20,GLNG,-24.1,-27.88161994,2.414330218,gnw,FLNG Gimi Force Majeure claim,"Gimi MS Corp. (the “Company”), a subsidiary of Golar LNG Ltd (Nasdaq: GLNG), received written notification of a force majeure claim (the “Notice”) from BP Mauritania Investments Ltd (“BP”) under the...",https://www.globenewswire.com/news-release/2020/04/07/2012917/0/en/FLNG-Gimi-Force-Majeure-claim.html,same
4/21/20,GLOG,-20.1,-22.11350294,1.761252446,gnw,"GasLog Ltd. and GasLog Partners LP Announce Date for First-Quarter 2020 Results, Conference Call and Webcast","Piraeus, Greece, April 19, 2020 (GLOBE NEWSWIRE) -- GasLog Ltd. (""GasLog"") (NYSE: GLOG) and GasLog Partners LP (""GasLog Partners"" or the ""Partnership"") (NYSE: GLOP) today announced that their...",https://www.globenewswire.com/news-release/2020/04/20/2018485/0/en/GasLog-Ltd-and-GasLog-Partners-LP-Announce-Date-for-First-Quarter-2020-Results-Conference-Call-and-Webcast.html,prev
4/21/20,GLOG,-20.1,-22.11350294,1.761252446,gnw,"GasLog Ltd. and GasLog Partners LP Announce Date for First-Quarter 2020 Results, Conference Call and Webcast","Piraeus, Greece, April 20, 2020 (GLOBE NEWSWIRE) -- GasLog Ltd. (""GasLog"") (NYSE: GLOG) and GasLog Partners LP (""GasLog Partners"" or the ""Partnership"") (NYSE: GLOP) today announced that their...",https://www.globenewswire.com/news-release/2020/04/20/2018486/0/en/GasLog-Ltd-and-GasLog-Partners-LP-Announce-Date-for-First-Quarter-2020-Results-Conference-Call-and-Webcast.html,prev
4/21/20,BRQS,-31.3,-29.17847026,1.416430595,gnw,Borqs Technologies Sees Significant Increase in Demand for Hi-tech Mobile Personal Safety & Tracking Device for Senior Citizens Particularly During the COVID-19 Environment,"SANTA CLARA, Calif., April 20, 2020 (GLOBE NEWSWIRE) -- Borqs Technologies, Inc. (Nasdaq: BRQS), (the “Company”, or “Borqs”), a global leader  in embedded software and products for the Internet of...",https://www.globenewswire.com/news-release/2020/04/20/2018645/0/en/Borqs-Technologies-Sees-Significant-Increase-in-Demand-for-Hi-tech-Mobile-Personal-Safety-Tracking-Device-for-Senior-Citizens-Particularly-During-the-COVID-19-Environment.html,prev
5/1/20,GPOR,-22.5,-22.95719844,1.167315175,gnw,Gulfport Adopts Tax Benefits Preservation Plan to Protect NOL Tax Assets,"OKLAHOMA CITY, April 30, 2020 (GLOBE NEWSWIRE) -- Gulfport Energy Corporation (NASDAQ: GPOR) (“Gulfport”), today announced that its Board of Directors (the “Board”) has unanimously adopted a tax...",https://www.globenewswire.com/news-release/2020/04/30/2025813/7561/en/Gulfport-Adopts-Tax-Benefits-Preservation-Plan-to-Protect-NOL-Tax-Assets.html,prev
5/6/20,MYSZ,-40.4,-30.76923077,36.92307692,gnw,"My Size, Inc. Announces $5.0 Million Public Offering","AIRPORT CITY, Israel, May 06, 2020 (GLOBE NEWSWIRE) -- My Size, Inc. (the “Company” or “My Size”) (NASDAQ: MYSZ) (TASE: MYSZ), the developer and creator of smartphone measurement solutions, today...",https://www.globenewswire.com/news-release/2020/05/06/2028518/0/en/My-Size-Inc-Announces-5-0-Million-Public-Offering.html,same
5/6/20,RTTR,-31.2,-20.43399638,10.30741411,gnw,Leading Independent Proxy Advisory Firms Recommend Ritter Pharmaceuticals Shareholders Vote in Favor of its Merger and Each of the Merger Proposals,"LOS ANGELES, May 06, 2020 (GLOBE NEWSWIRE) -- Ritter Pharmaceuticals, Inc. (Nasdaq: RTTR) (“Ritter Pharmaceuticals” or the “Company”), today announced that Institutional Shareholder Services Inc....",https://www.globenewswire.com/news-release/2020/05/06/2028503/0/en/Leading-Independent-Proxy-Advisory-Firms-Recommend-Ritter-Pharmaceuticals-Shareholders-Vote-in-Favor-of-its-Merger-and-Each-of-the-Merger-Proposals.html,same
5/13/20,SLGG,-20.2,-36.64921466,13.43804538,gnw,"Super League Gaming, Inc. Prices At-The-Market $6,387,500 Common Stock Offering","SANTA MONICA, Calif., May 13, 2020 (GLOBE NEWSWIRE) -- SUPER LEAGUE GAMING, INC. (NASDAQ: SLGG) (“Super League Gaming” or the “Company”), a global leader in competitive video gaming and esports...",https://www.globenewswire.com/news-release/2020/05/13/2032944/0/en/Super-League-Gaming-Inc-Prices-At-The-Market-6-387-500-Common-Stock-Offering.html,same
5/13/20,SLGG,-20.2,-36.64921466,13.43804538,gnw,Super League Gaming’s Fully-Remote Production Platform Can Provide Much-Needed Solutions for COVID-Impacted Entertainment Projects,"SANTA MONICA, Calif., May 12, 2020 (GLOBE NEWSWIRE) -- Super League Gaming (Nasdaq: SLGG), a global leader in competitive video gaming and esports entertainment for everyday players around the...",https://www.globenewswire.com/news-release/2020/05/12/2031841/0/en/Super-League-Gaming-s-Fully-Remote-Production-Platform-Can-Provide-Much-Needed-Solutions-for-COVID-Impacted-Entertainment-Projects.html,prev
5/14/20,CLBS,-21.3,-21.65898618,15.20737327,gnw,Caladrius Biosciences Reports Positive Full Results for CLBS16 from the ESCaPE-CMD Trial at SCAI 2020 Scientific Sessions,"BASKING RIDGE, N.J., May 14, 2020 (GLOBE NEWSWIRE) -- Caladrius Biosciences, Inc. (Nasdaq: CLBS) (“Caladrius” or the “Company”), a clinical-stage biopharmaceutical company dedicated to the...",https://www.globenewswire.com/news-release/2020/05/14/2033809/18623/en/Caladrius-Biosciences-Reports-Positive-Full-Results-for-CLBS16-from-the-ESCaPE-CMD-Trial-at-SCAI-2020-Scientific-Sessions.html,same
5/21/20,CIDM,-21.3,-26.47058824,2.941176471,gnw,Cinedigm Corp. Announces $8 Million Registered Direct Offering Priced At-The-Market Under Nasdaq Rules,"LOS ANGELES, May 20, 2020 (GLOBE NEWSWIRE) -- Cinedigm (NASDAQ: CIDM) (“Cinedigm” or the “Company”), today announced it has entered into definitive agreements with investors for the purchase and...",https://www.globenewswire.com/news-release/2020/05/20/2036658/0/en/Cinedigm-Corp-Announces-8-Million-Registered-Direct-Offering-Priced-At-The-Market-Under-Nasdaq-Rules.html,prev
5/21/20,CIDM,-21.3,-26.47058824,2.941176471,gnw,"Cinedigm Expands US Distribution Via Launch of CONtv, Dove Channel, Comedy Dynamics & Docurama on Amazon’s IMDb TV","LOS ANGELES, May 20, 2020 (GLOBE NEWSWIRE) -- Cinedigm (NASDAQ: CIDM) announced today that IMDb TV is now offering Cinedigm’s free ad-supported linear channels CONtv, Dove Channel, Comedy Dynamics...",https://www.globenewswire.com/news-release/2020/05/20/2036411/0/en/Cinedigm-Expands-US-Distribution-Via-Launch-of-CONtv-Dove-Channel-Comedy-Dynamics-Docurama-on-Amazon-s-IMDb-TV.html,prev
5/21/20,SPN,-20.8,-26.66666667,0,gnw,Superior Energy Services Announces First Quarter 2020 Results,"HOUSTON, May 21, 2020 (GLOBE NEWSWIRE) -- Superior Energy Services, Inc. (NYSE: SPN) (the “Company”) today announced a net loss from continuing operations for the first quarter of 2020 of $32.3...",https://www.globenewswire.com/news-release/2020/05/21/2036914/0/en/Superior-Energy-Services-Announces-First-Quarter-2020-Results.html,same
6/10/20,DUO,-66.4,-74.688,20,gnw,FangDD Reports First Quarter 2020 Unaudited Financial Results,"SHENZHEN, China, June 10, 2020 (GLOBE NEWSWIRE) -- Fangdd Network Group Ltd. (NASDAQ: DUO) (“FangDD” or “the Company”), a leading property technology company in China, today announced its unaudited...",https://www.globenewswire.com/news-release/2020/06/10/2046061/0/en/FangDD-Reports-First-Quarter-2020-Unaudited-Financial-Results.html,same
6/10/20,DUO,-66.4,-74.688,20,gnw,FangDD States Its Policy Not to Comment on Unusual Market Activity or Speculative Matters,"SHENZHEN, China, June 10, 2020 (GLOBE NEWSWIRE) -- Fangdd Network Group Ltd. (NASDAQ: DUO) (“FangDD” or the “Company”) is a leading property technology company in China. In light of the increases in...",https://www.globenewswire.com/news-release/2020/06/10/2046038/0/en/FangDD-States-Its-Policy-Not-to-Comment-on-Unusual-Market-Activity-or-Speculative-Matters.html,same
6/11/20,JFIN,-32.8,-40,3.538461538,gnw,Jiayin Group States Its Policy Not To Comment On Unusual Market Activity Or Speculative Matters,"SHANGHAI, June 11, 2020 (GLOBE NEWSWIRE) -- Jiayin Group Inc. (“Jiayin” or the “Company”) (NASDAQ: JFIN) is a leading fintech platform in China. In light of unusual increases in the price and...",https://www.globenewswire.com/news-release/2020/06/11/2047024/0/en/Jiayin-Group-States-Its-Policy-Not-To-Comment-On-Unusual-Market-Activity-Or-Speculative-Matters.html,same
6/11/20,JFIN,-32.8,-40,3.538461538,gnw,Jiayin Group Inc. Reports First Quarter 2020 Unaudited Financial Results,"SHANGHAI, China, June 11, 2020 (GLOBE NEWSWIRE) -- Jiayin Group Inc. (“Jiayin” or the “Company”) (NASDAQ: JFIN), a leading fintech platform in China, today announced its unaudited financial results...",https://www.globenewswire.com/news-release/2020/06/11/2046700/0/en/Jiayin-Group-Inc-Reports-First-Quarter-2020-Unaudited-Financial-Results.html,same
6/12/20,IZEA,-39,-38.57142857,7.142857143,gnw,IZEA Announces Shake™,"Orlando, Florida, June 12, 2020 (GLOBE NEWSWIRE) -- IZEA Worldwide, Inc. (NASDAQ: IZEA), the premier provider of influencer marketing technology, data, and services for the world’s leading brands,...",https://www.globenewswire.com/news-release/2020/06/12/2047616/37163/en/IZEA-Announces-Shake.html,same
6/26/20,HCR,-50,-20.72560467,0,gnw,Hi-Crush Inc. Reports First Quarter 2020 Results and Provides Additional Financial and Operational Updates,"HOUSTON, June 25, 2020 (GLOBE NEWSWIRE) -- Hi-Crush Inc. (NYSE: HCR) (""Hi-Crush"" or the ""Company""), a fully-integrated provider of proppant logistics solutions, today reported first quarter 2020...",https://www.globenewswire.com/news-release/2020/06/25/2053773/0/en/Hi-Crush-Inc-Reports-First-Quarter-2020-Results-and-Provides-Additional-Financial-and-Operational-Updates.html,prev
6/29/20,BIMI,-21.7,-23.31081081,1.351351351,gnw,BOQI International Medical Announces First Quarter 2020 Financial Results,"NEW YORK, June 29, 2020 (GLOBE NEWSWIRE) -- BOQI International Medical Inc. (NASDAQ: BIMI) (“BIMI” or the “Company”) today announced its financial results for the fiscal quarter ended March 31,...",https://www.globenewswire.com/news-release/2020/06/29/2054968/0/en/BOQI-International-Medical-Announces-First-Quarter-2020-Financial-Results.html,same
7/6/20,GNUS,-25.1,-24,3.714285714,gnw,"Genius Brands International, Inc. Issues Shareholder Letter","BEVERLY HILLS, Calif., July 06, 2020 (GLOBE NEWSWIRE) -- Genius Brands International, Inc. ""Genius Brands"" (NASDAQ: GNUS), the global brand management company that creates and licenses multimedia...",https://www.globenewswire.com/news-release/2020/07/06/2058008/0/en/Genius-Brands-International-Inc-Issues-Shareholder-Letter.html,same
7/6/20,GNUS,-25.1,-24,3.714285714,gnw,Genius Brands International Announces Transaction to Create “Stan Lee Universe”,"BEVERLY HILLS, Calif., July 06, 2020 (GLOBE NEWSWIRE) -- Through a groundbreaking joint venture between Genius Brands International (“Genius Brands”) (NASDAQ:GNUS) and Stan Lee’s POW! Entertainment,...",https://www.globenewswire.com/news-release/2020/07/06/2057968/0/en/Genius-Brands-International-Announces-Transaction-to-Create-Stan-Lee-Universe.html,same
7/13/20,NXTC,-54.4,-35.92767296,1.965408805,gnw,NextCure Provides an Interim Update of the Phase 2 Portion of the NC318 Monotherapy Phase 1/2 Trial and Announces Departure of Chief Medical Officer,"BELTSVILLE, Md., July 13, 2020 (GLOBE NEWSWIRE) -- NextCure, Inc. (Nasdaq: NXTC), a clinical-stage biopharmaceutical company committed to discovering and developing novel, first-in-class...",https://www.globenewswire.com/news-release/2020/07/13/2061067/0/en/NextCure-Provides-an-Interim-Update-of-the-Phase-2-Portion-of-the-NC318-Monotherapy-Phase-1-2-Trial-and-Announces-Departure-of-Chief-Medical-Officer.html,same
7/13/20,NXTC,-54.4,-36.07843137,1.725490196,gnw,NextCure Provides an Interim Update of the Phase 2 Portion of the NC318 Monotherapy Phase 1/2 Trial and Announces Departure of Chief Medical Officer,"BELTSVILLE, Md., July 13, 2020 (GLOBE NEWSWIRE) -- NextCure, Inc. (Nasdaq: NXTC), a clinical-stage biopharmaceutical company committed to discovering and developing novel, first-in-class...",https://www.globenewswire.com/news-release/2020/07/13/2061067/0/en/NextCure-Provides-an-Interim-Update-of-the-Phase-2-Portion-of-the-NC318-Monotherapy-Phase-1-2-Trial-and-Announces-Departure-of-Chief-Medical-Officer.html,same
7/27/20,IPDN,-31.1,-28.10810811,0,gnw,Professional Diversity Network Announces $2 Million Registered Direct Offering,"CHICAGO, July 27, 2020 (GLOBE NEWSWIRE) -- Professional Diversity Network, Inc. (Nasdaq: IPDN), today announced it has entered into definitive agreements with institutional investors for the...",https://www.globenewswire.com/news-release/2020/07/27/2068002/25762/en/Professional-Diversity-Network-Announces-2-Million-Registered-Direct-Offering.html,same
7/31/20,TAOP,-58.2,-39.86928105,9.477124183,gnw,TAOP Upgrades Taoping Smart Cloud Platform to Expand its Business,"SHENZHEN, China, July 30, 2020 (GLOBE NEWSWIRE) -- Taoping Inc. (NASDAQ: TAOP), a leading provider of internet-based smart display screens, and a new-media ecosystem that enables targeted...",https://www.globenewswire.com/news-release/2020/07/30/2070321/0/en/TAOP-Upgrades-Taoping-Smart-Cloud-Platform-to-Expand-its-Business.html,prev
7/31/20,PRPO,-55.1,-36.56565657,2.02020202,gnw,Precipio Announces Commercial Launch of COVID-19 Antibody Test,"NEW HAVEN, Conn., July 30, 2020 (GLOBE NEWSWIRE) -- Specialty diagnostics company Precipio, Inc. (NASDAQ: PRPO), is announcing its COVID-19 strategy, and its intent to contribute to the battle...",https://www.globenewswire.com/news-release/2020/07/30/2070488/0/en/Precipio-Announces-Commercial-Launch-of-COVID-19-Antibody-Test.html,prev
8/6/20,NETE,-28.6,-26.67588113,0.138217001,gnw,Net Element Enters Definitive Merger Agreement with Electric Vehicle Company Mullen Technologies,"MIAMI, Aug. 05, 2020 (GLOBE NEWSWIRE) -- via NetworkWire -- Net Element, Inc. (NASDAQ: NETE) (“Net Element” or the “Company”) today announced the execution of a definitive agreement to merge with...",https://www.globenewswire.com/news-release/2020/08/05/2073313/0/en/Net-Element-Enters-Definitive-Merger-Agreement-with-Electric-Vehicle-Company-Mullen-Technologies.html,prev
8/7/20,VIVO,-20.5,-24.23529412,0.392156863,gnw,Meridian Bioscience Reports Fiscal Third Quarter 2020 Operating Results – Best Quarter in Company History – Raises Full Year Guidance,"CINCINNATI, Aug. 07, 2020 (GLOBE NEWSWIRE) -- Meridian Bioscience, Inc. (NASDAQ: VIVO) today announced financial results for the fiscal third quarter ended June 30, 2020. Third Quarter Fiscal...",https://www.globenewswire.com/news-release/2020/08/07/2074929/0/en/Meridian-Bioscience-Reports-Fiscal-Third-Quarter-2020-Operating-Results-Best-Quarter-in-Company-History-Raises-Full-Year-Guidance.html,same
8/11/20,FULC,-48,-25.83333333,0,gnw,Fulcrum Therapeutics Reports Recent Business Highlights and Second Quarter 2020 Financial Results,"– Conference call scheduled for 8:00 a.m. ET today – CAMBRIDGE, Mass., Aug. 11, 2020 (GLOBE NEWSWIRE) -- Fulcrum Therapeutics, Inc. (Nasdaq: FULC), a clinical-stage...",https://www.globenewswire.com/news-release/2020/08/11/2076264/0/en/Fulcrum-Therapeutics-Reports-Recent-Business-Highlights-and-Second-Quarter-2020-Financial-Results.html,same
8/13/20,SMRT,-32.3,-22.88401254,12.85266458,gnw,"Stein Mart, Inc. Voluntarily Files Chapter 11 Bankruptcy","JACKSONVILLE, Fla., Aug. 12, 2020 (GLOBE NEWSWIRE) -- Stein Mart, Inc. (NASDAQ: SMRT) today announced that it and its subsidiaries (collectively, the “Company”) have filed voluntary petitions for...",https://www.globenewswire.com/news-release/2020/08/12/2077092/10490/en/Stein-Mart-Inc-Voluntarily-Files-Chapter-11-Bankruptcy.html,prev
8/14/20,AWH,-22.2,-20.25316456,0.253164557,gnw,UPDATE – Aspira Women’s Health Reports Second Quarter 2020 Financial Results,"AUSTIN, Texas, Aug. 14, 2020 (GLOBE NEWSWIRE) -- Aspira Women’s Health Inc. (“ASPIRA”) (Nasdaq: AWH), a bio-analytical based women’s health company focused on gynecologic disease, today reported its...",https://www.globenewswire.com/news-release/2020/08/14/2078807/0/en/UPDATE-Aspira-Women-s-Health-Reports-Second-Quarter-2020-Financial-Results.html,same
8/14/20,AWH,-22.2,-20.25316456,0.253164557,gnw,Aspira Women’s Health Reports Second Quarter 2020 Financial Results,"AUSTIN, Texas, Aug. 13, 2020 (GLOBE NEWSWIRE) -- Aspira Women’s Health Inc. (“ASPIRA”) (Nasdaq: AWH), a bio-analytical based women’s health company focused on gynecologic disease, today reported its...",https://www.globenewswire.com/news-release/2020/08/13/2078188/0/en/Aspira-Women-s-Health-Reports-Second-Quarter-2020-Financial-Results.html,prev
8/21/20,VVPR,-27,-20.84592145,0,gnw,VivoPower International PLC Earnings Conference Call Details,"LONDON, Aug. 21, 2020 (GLOBE NEWSWIRE) -- VivoPower International PLC (NASDAQ: VVPR, “VivoPower”, the ""Company”) is pleased to confirm details for the upcoming earnings conference call on Monday,...",https://www.globenewswire.com/news-release/2020/08/21/2082010/0/en/VivoPower-International-PLC-Earnings-Conference-Call-Details.html,same
8/21/20,VVPR,-27,-20.84592145,0,gnw,VivoPower International PLC Announces Contract for the New Carroll Cotton Gin,"LONDON, Aug. 20, 2020 (GLOBE NEWSWIRE) -- VivoPower International PLC (NASDAQ: VVPR, the “Company”) ”), an international solar and critical power services company, is pleased to announce that its...",https://www.globenewswire.com/news-release/2020/08/20/2081421/0/en/VivoPower-International-PLC-Announces-Contract-for-the-New-Carroll-Cotton-Gin.html,prev
8/27/20,AKER,-31.5,-27.10997443,1.023017903,gnw,Akers Biosciences and Premas Biotech Announce SARS CoV-2 Positive Proof of Concept Results,"Thorofare, New Jersey, Aug. 27, 2020 (GLOBE NEWSWIRE) -- Akers Biosciences, Inc. (the “Company”) (NASDAQ: AKER), a developer of rapid health information technologies, today announced with its...",https://www.globenewswire.com/news-release/2020/08/27/2084832/29748/en/Akers-Biosciences-and-Premas-Biotech-Announce-SARS-CoV-2-Positive-Proof-of-Concept-Results.html,same
8/27/20,KLDO,-22.3,-22.28704784,0,gnw,Kaleido Biosciences Announces Presentation of Data for Microbiome Metabolic Therapy KB174 for Hepatic Encephalopathy at The Digital International Liver Congress™ (EASL),"LEXINGTON, Mass., Aug. 27, 2020 (GLOBE NEWSWIRE) -- Kaleido Biosciences, Inc. (Nasdaq: KLDO) today announced that data from Microbiome Metabolic Therapy (MMT™) candidate KB174 for hepatic...",https://www.globenewswire.com/news-release/2020/08/27/2084649/0/en/Kaleido-Biosciences-Announces-Presentation-of-Data-for-Microbiome-Metabolic-Therapy-KB174-for-Hepatic-Encephalopathy-at-The-Digital-International-Liver-Congress-EASL.html,same
9/2/20,SNSS,-37,-35.15384615,2.115384615,gnw,Sunesis Pharmaceuticals Announces 1-for-10 Reverse Stock Split,"SOUTH SAN FRANCISCO, Calif., Sept. 02, 2020 (GLOBE NEWSWIRE) -- Sunesis Pharmaceuticals, Inc. (Nasdaq: SNSS) today announced that it has filed a Certificate of Amendment to its Amended and Restated...",https://www.globenewswire.com/news-release/2020/09/02/2087934/14761/en/Sunesis-Pharmaceuticals-Announces-1-for-10-Reverse-Stock-Split.html,same
