date,ticker,pct_change_prev_close,day_percent_change,max_day_percent_change,source,title,description,url,same_or_prev
2/24/17,GRAM,-34.8,-34.12698413,1.19047619,bw,INVESTOR ALERT: Law Offices of Howard G. Smith Commences Investigation on Behalf of Grana Y Montero SA Investors,Law Offices of Howard G. Smith announces an investigation on behalf of Grana Y Montero SA (“Grana Y Montero” or the “Company”) (NYSE: GRAM) investors concerning the Company and its officers’ potential...,http://www.businesswire.com/news/home/20170224005850/en/INVESTOR-ALERT-Law-Offices-of-Howard-G.-Smith-Commences-Investigation-on-Behalf-of-Grana-Y-Montero-SA-Investors,same
2/24/17,GRAM,-34.8,-34.12698413,1.19047619,bw,EQUITY ALERT: Rosen Law Firm Announces Investigation of Securities Claims Against Graña y Montero S.A.A.,"Rosen Law Firm, a global investor rights law firm, announces it is investigating potential securities claims on behalf of shareholders of Graña y Montero S.A.A.. (NYSE:GRAM) resulting from allegations...",http://www.businesswire.com/news/home/20170224005794/en/EQUITY-ALERT-Rosen-Law-Firm-Announces-Investigation-of-Securities-Claims-Against-Gra%C3%B1a-y-Montero-S.A.A.,same
2/27/17,GRAM,-26.5,-26.28398792,1.812688822,bw,"IMPORTANT INVESTOR ALERT: Khang & Khang LLP Announces Securities Class Action Lawsuit against Graña y Montero SAA, and Encourages Investors with Losses to Contact the Firm",Khang & Khang LLP (the “Firm”) announces the filing of a class action lawsuit against Graña y Montero SAA (“Graña” or the “Company”) (NYSE: GRAM). Investors who purchased or otherwise acquired Gra...,http://www.businesswire.com/news/home/20170227006710/en/IMPORTANT-INVESTOR-ALERT-Khang-Khang-LLP-Announces-Securities-Class-Action-Lawsuit-against-Gra%C3%B1a-y-Montero-SAA-and-Encourages-Investors-with-Losses-to-Contact-the-Firm,same
2/27/17,GRAM,-26.5,-26.28398792,1.812688822,bw,"Bragar Eagel & Squire, P.C. Is Investigating Graña y Montero S.A.A. (GRAM) on Behalf of Stockholders and Encourages Investors with Losses to Contact the Firm","Bragar Eagel & Squire, P.C. is investigating potential claims against the board of directors of Graña y Montero S.A.A. (NYSE:GRAM). Our investigation concerns potential breach of fiduciary duty an...",http://www.businesswire.com/news/home/20170227006560/en/Bragar-Eagel-Squire-P.C.-Is-Investigating-Gra%C3%B1a%C2%A0y%C2%A0Montero%C2%A0S.A.A.-GRAM-on-Behalf-of-Stockholders-and-Encourages-Investors-with-Losses-to-Contact-the-Firm,same
2/27/17,GRAM,-26.5,-26.28398792,1.812688822,bw,"SHAREHOLDER ALERT: Goldberg Law PC Announces the filing of a Class Action Lawsuit against Graña y Montero SAA, and Advises Investors with Losses to Contact the Firm",Goldberg Law PC announces the filing of a class action lawsuit against Graña y Montero SAA (“Graña” or the “Company”) (NYSE: GRAM). Investors who purchased or otherwise acquired Graña shares between A...,http://www.businesswire.com/news/home/20170227006639/en/SHAREHOLDER-ALERT-Goldberg-Law-PC-Announces-the-filing-of-a-Class-Action-Lawsuit-against-Gra%C3%B1a-y-Montero-SAA-and-Advises-Investors-with-Losses-to-Contact-the-Firm,same
2/27/17,GRAM,-26.5,-26.28398792,1.812688822,bw,EQUITY ALERT: Rosen Law Firm Files Securities Class Action Lawsuit Against Graña y Montero S.A.A. – GRAM,"Rosen Law Firm, a global investor rights law firm, announces that it has filed a class action lawsuit on behalf of purchasers of Graña y Montero S.A.A. American Depositary Shares (NYSE:GRAM) from Apri...",http://www.businesswire.com/news/home/20170227006568/en/EQUITY-ALERT-Rosen-Law-Firm-Files-Securities-Class-Action-Lawsuit-Against-Gra%C3%B1a-y-Montero-S.A.A.-%E2%80%93-GRAM,same
2/27/17,GRAM,-26.5,-26.28398792,1.812688822,bw,"INVESTOR ALERT: Investigation of Graña y Montero Announced by Holzer & Holzer, LLC","Holzer & Holzer, LLC is investigating whether certain statements issued by Graña y Montero, S.A.A. (“Graña” or the “Company”) (NYSE: GRAM) complied with federal securities laws. On February 24, 20...",http://www.businesswire.com/news/home/20170227006545/en/INVESTOR-ALERT-Investigation-of-Gra%C3%B1a-y-Montero%C2%A0Announced-by-Holzer-Holzer-LLC,same
2/27/17,GRAM,-26.5,-26.28398792,1.812688822,bw,IMPORTANT SHAREHOLDER ALERT: Khang & Khang LLP Announces an Investigation of Graña y Montero SAA and Encourages Investors with Losses to Contact the Firm,Khang & Khang LLP (the “Firm”) announces that it is investigating claims against Graña y Montero SAA (“Graña” or the “Company”) (NYSE: GRAM) concerning possible violations of federal securities la...,http://www.businesswire.com/news/home/20170227006247/en/IMPORTANT-SHAREHOLDER-ALERT-Khang-Khang-LLP-Announces-an-Investigation-of-Gra%C3%B1a-y-Montero-SAA-and-Encourages-Investors-with-Losses-to-Contact-the-Firm,same
2/27/17,GRAM,-26.5,-26.28398792,1.812688822,bw,"SHAREHOLDER ALERT: Levi & Korsinsky, LLP Announces an Investigation Involving the Board of Graña y Montero S.A.A.","Levi & Korsinsky announces it has commenced an investigation of Graña y Montero S.A.A. (NYSE:GRAM). On February 24, 2017, a report disclosed that Graña was aware of $20 million in bribes conferred...",http://www.businesswire.com/news/home/20170227006206/en/SHAREHOLDER-ALERT-Levi-Korsinsky-LLP-Announces-an-Investigation-Involving-the-Board-of-Gra%C3%B1a-y-Montero-S.A.A.,same
2/27/17,GRAM,-26.5,-26.28398792,1.812688822,bw,Glancy Prongay & Murray LLP Commences Investigation on Behalf of Grana Y Montero SA Investors,Glancy Prongay & Murray LLP (“GPM”) announces an investigation on behalf of Grana Y Montero SA (“Grana Y Montero” or the “Company”) (NYSE: GRAM) investors concerning the Company and its officers’...,http://www.businesswire.com/news/home/20170227005294/en/Glancy-Prongay-Murray-LLP-Commences-Investigation-on-Behalf-of-Grana-Y-Montero-SA-Investors,same
3/6/17,NH,-23.3,-22.96918768,0,bw,"INVESTOR ALERT: Law Offices of Howard G. Smith Commences Investigation on Behalf of NantHealth, Inc. Investors","Law Offices of Howard G. Smith announces an investigation on behalf of investors of NantHealth, Inc. (“NantHealth” or the “Company”) (NASDAQ: NH) investors concerning the Company and its officers’ pos...",http://www.businesswire.com/news/home/20170306006368/en/INVESTOR-ALERT-Law-Offices-of-Howard-G.-Smith-Commences-Investigation-on-Behalf-of-NantHealth-Inc.-Investors,same
3/6/17,NH,-23.3,-22.96918768,0,bw,"SHAREHOLDER ALERT: Levi & Korsinsky, LLP Announces the Commencement of an Investigation Involving Possible Securities Fraud Violations by Certain Officers and Directors of NantHealth, Inc.","Levi & Korsinsky announces it has commenced an investigation of NantHealth, Inc. (NASDAQ:NH) concerning possible violations of federal securities laws. On March 6, 2017, the publication STAT relea...",http://www.businesswire.com/news/home/20170306006331/en/SHAREHOLDER-ALERT-Levi-Korsinsky-LLP-Announces-the-Commencement-of-an-Investigation-Involving-Possible-Securities-Fraud-Violations-by-Certain-Officers-and-Directors-of-NantHealth-Inc.,same
3/6/17,NH,-23.3,-22.96918768,0,bw,"EQUITY ALERT: Rosen Law Firm Announces Investigation of Securities Claims Against NantHealth, Inc. – NH","Rosen Law Firm, a global investor rights law firm, announces it is investigating potential securities claims on behalf of shareholders of NantHealth, Inc. (NASDAQ:NH) resulting from allegations that N...",http://www.businesswire.com/news/home/20170306006234/en/EQUITY-ALERT-Rosen-Law-Firm-Announces-Investigation-of-Securities-Claims-Against-NantHealth-Inc.-%E2%80%93-NH,same
3/6/17,NH,-23.3,-22.96918768,0,bw,"SHAREHOLDER ALERT: Goldberg Law PC Announces an Investigation of NantHealth, Inc. and Advises Investors with Losses to Contact the Firm","Goldberg Law PC announces that it is investigating NantHealth, Inc. (“NantHealth” or the “Company”) (Nasdaq: NH) concerning possible violations of federal securities laws. If you purchased or otherwis...",http://www.businesswire.com/news/home/20170306006139/en/SHAREHOLDER-ALERT-Goldberg-Law-PC-Announces-an-Investigation-of-NantHealth-Inc.-and-Advises-Investors-with-Losses-to-Contact-the-Firm,same
3/6/17,NH,-23.3,-22.96918768,0,bw,"Glancy Prongay & Murray LLP Commences Investigation on Behalf of NantHealth, Inc. Investors","Glancy Prongay & Murray LLP (“GPM”) announces an investigation on behalf of NantHealth, Inc. (“NantHealth” or the “Company”) (NASDAQ: NH) investors concerning the Company and its officers’ possibl...",http://www.businesswire.com/news/home/20170306006065/en/Glancy-Prongay-Murray-LLP-Commences-Investigation-on-Behalf-of-NantHealth-Inc.-Investors,same
3/31/17,ACOR,-21.5,-21.34831461,2.247191011,bw,U.S. District Court Issues Decision to Invalidate Four AMPYRA Patents; Company Will Appeal Ruling,"Acorda Therapeutics, Inc. (Nasdaq: ACOR ) today announced that the United States District Court for the District of Delaware upheld U.S. Patent No. 5,540,938 (the ‘938 patent), which pertains to the f...",http://www.businesswire.com/news/home/20170331005631/en/U.S.-District-Court-Issues-Decision-to-Invalidate-Four-AMPYRA-Patents-Company-Will-Appeal-Ruling,same
5/2/17,AEZS,-33.3,-25,3.333333333,bw,"Aeterna Zentaris to Announce First Quarter 2017 Financial and Operating Results on May 8, 2017","Aeterna Zentaris Inc. (NASDAQ: AEZS)(TSX: AEZS) (the “Company”) will announce its first quarter 2017 financial and operating results after market close on Monday, May 8, 2017. The Company will host a...",http://www.businesswire.com/news/home/20170502005148/en/Aeterna-Zentaris-to-Announce-First-Quarter-2017-Financial-and-Operating-Results-on-May-8-2017,same
5/2/17,AEZS,-33.3,-25,3.333333333,bw,Aeterna Zentaris Announces that ZoptEC Phase 3 Clinical Study of Zoptrex™ Did Not Achieve its Primary Endpoint,"Aeterna Zentaris Inc. (NASDAQ:AEZS) (TSX:AEZS) (the “Company”) today announced that the ZoptEC Phase 3 clinical study of Zoptrex™ (zoptarelin doxorubicin) in women with locally advanced, recurrent or...",http://www.businesswire.com/news/home/20170501005409/en/Aeterna-Zentaris-Announces-that-ZoptEC-Phase-3-Clinical-Study-of-Zoptrex%E2%84%A2-Did-Not-Achieve-its-Primary-Endpoint,prev
5/10/17,PME,-28.2,-28.04878049,6.585365854,bw,IMPORTANT INVESTOR ALERT: Lundin Law PC Announces an Investigation of Pingtan Marine Enterprise Ltd. and Advises Investors with Losses to Contact the Firm,"Lundin Law PC, a shareholder rights firm, announces that it is investigating claims against Pingtan Marine Enterprise Ltd. (“Pingtan” or the “Company”) (Nasdaq: PME) concerning possible violations of...",http://www.businesswire.com/news/home/20170510006688/en/IMPORTANT-INVESTOR-ALERT-Lundin-Law-PC-Announces-an-Investigation-of-Pingtan-Marine-Enterprise-Ltd.-and-Advises-Investors-with-Losses-to-Contact-the-Firm,same
5/10/17,PME,-28.2,-28.04878049,6.585365854,bw,Glancy Prongay & Murray LLP Commences Investigation on Behalf of Pingtan Marine Enterprise Ltd. Investors,Glancy Prongay & Murray LLP (“GPM”) announces an investigation on behalf of Pingtan Marine Enterprise Ltd. (“Pingtan” or the “Company”) (NASDAQ: PME) investors concerning the Company and its offic...,http://www.businesswire.com/news/home/20170510006647/en/Glancy-Prongay-Murray-LLP-Commences-Investigation-on-Behalf-of-Pingtan-Marine-Enterprise-Ltd.-Investors,same
5/10/17,PME,-28.2,-28.04878049,6.585365854,bw,IMPORTANT SHAREHOLDER ALERT: Khang & Khang LLP Announces an Investigation of Pingtan Marine Enterprise Ltd. and Encourages Investors with Losses to Contact the Firm,Khang & Khang LLP (the “Firm”) announces that it is investigating claims against Pingtan Marine Enterprise Ltd. (“Pingtan” or the “Company”) (Nasdaq: PME) concerning possible violations of federal...,http://www.businesswire.com/news/home/20170510006486/en/IMPORTANT-SHAREHOLDER-ALERT-Khang-Khang-LLP-Announces-an-Investigation-of-Pingtan-Marine-Enterprise-Ltd.-and-Encourages-Investors-with-Losses-to-Contact-the-Firm,same
5/10/17,PME,-28.2,-28.04878049,6.585365854,bw,INVESTOR ALERT: Goldberg Law PC Announces an Investigation of Pingtan Marine Enterprise Ltd.,"Goldberg Law PC, a national shareholder rights litigation firm, announces that it is investigating claims on behalf of investors of Pingtan Marine Enterprise (“Pingtan” or the “Company”) (Nasdaq: PME)...",http://www.businesswire.com/news/home/20170510006421/en/INVESTOR-ALERT-Goldberg-Law-PC-Announces-an-Investigation-of-Pingtan-Marine-Enterprise-Ltd.,same
5/10/17,PME,-28.2,-28.04878049,6.585365854,bw,"INVESTOR ALERT: Levi & Korsinsky, LLP Reminds Shareholders of an Investigation Involving Possible Securities Fraud Violations by Certain Officers and Directors of Pingtan Marine Enterprise Ltd.","Levi & Korsinsky, LLP announces it has commenced an investigation of Pingtan Marine Enterprise Ltd. (“Pingtan”) (NASDAQ:PME) concerning possible violations of federal securities laws. On May 10, 2...",http://www.businesswire.com/news/home/20170510006284/en/INVESTOR-ALERT-Levi-Korsinsky-LLP-Reminds-Shareholders-of-an-Investigation-Involving-Possible-Securities-Fraud-Violations-by-Certain-Officers-and-Directors-of-Pingtan-Marine-Enterprise-Ltd.,same
5/10/17,PME,-28.2,-28.04878049,6.585365854,bw,IMPORTANT SHAREHOLDER ALERT: Lundin Law PC Announces an Investigation of Pingtan Marine Enterprise Ltd. and Advises Investors with Losses to Contact the Firm,"Lundin Law PC, a shareholder rights firm, announces that it is investigating claims against Pingtan Marine Enterprise Ltd. (“Pingtan” or the “Company”) (Nasdaq: PME) concerning possible violations of...",http://www.businesswire.com/news/home/20170510006266/en/IMPORTANT-SHAREHOLDER-ALERT-Lundin-Law-PC-Announces-an-Investigation-of-Pingtan-Marine-Enterprise-Ltd.-and-Advises-Investors-with-Losses-to-Contact-the-Firm,same
5/10/17,PME,-28.2,-28.04878049,6.585365854,bw,INVESTOR ALERT: Investigation of Pingtan Marine Announced by Holzer & Holzer,"Holzer & Holzer, LLC is investigating whether certain statements issued by Pingtan Marine Enterprise, LTD (“Pingtan Marine” or the “Company”) (NASDAQ: PME) complied with federal securities laws. O...",http://www.businesswire.com/news/home/20170510006206/en/INVESTOR-ALERT-Investigation-of-Pingtan-Marine%C2%A0Announced-by-Holzer-Holzer,same
5/10/17,PME,-28.2,-28.04878049,6.585365854,bw,EQUITY ALERT: Rosen Law Firm Announces Investigation of Securities Claims Against Pingtan Marine Enterprise Ltd. - PME,"Rosen Law Firm, a global investor rights law firm, announces it is investigating potential securities claims on behalf of shareholders of Pingtan Marine Enterprise Ltd. (NASDAQ: PME) resulting from al...",http://www.businesswire.com/news/home/20170510006186/en/EQUITY-ALERT-Rosen-Law-Firm-Announces-Investigation-of-Securities-Claims-Against-Pingtan-Marine-Enterprise-Ltd.---PME,same
7/24/17,DRYS,-23,-33.19990255,19.59962365,bw,The Klein Law Firm Reminds Investors of an Investigation Concerning Possible Violations of Federal Securities Laws by DryShips Inc. (DRYS),The Klein Law Firm announces the commencement of an investigation of DryShips Inc. (NASDAQ:DRYS) concerning possible violations of federal securities laws. In a series of transactions beginning on or...,http://www.businesswire.com/news/home/20170724005740/en/The-Klein-Law-Firm-Reminds-Investors-of-an-Investigation-Concerning-Possible-Violations-of-Federal-Securities-Laws-by-DryShips-Inc.-DRYS,same
7/26/17,EGRX,-23.8,-24.02846975,2.320284698,bw,Eagle Pharmaceuticals Receives Complete Response Letter from FDA on RYANODEX for Exertional Heat Stroke Application,"Eagle Pharmaceuticals, Inc. (Nasdaq:EGRX) (“Eagle” or “the Company”) announced today that it has received a Complete Response Letter from the U.S. Food and Drug Administration (FDA) regarding its 505(...",http://www.businesswire.com/news/home/20170726005970/en/Eagle-Pharmaceuticals-Receives-Complete-Response-Letter-from-FDA-on-RYANODEX-for-Exertional-Heat-Stroke-Application,same
7/26/17,EGRX,-23.8,-24.02846975,2.320284698,bw,"Eagle Pharmaceuticals, Inc. Issues Statement Regarding RYANODEX Application PDUFA Date for Exertional Heat Stroke","Eagle Pharmaceuticals, Inc. (“Eagle” or “the Company”) (Nasdaq: EGRX) today issued a statement that it has not yet received correspondence from the US Food and Drug Administration (FDA) regarding its...",http://www.businesswire.com/news/home/20170725005895/en/Eagle-Pharmaceuticals-Inc.-Issues-Statement-Regarding-RYANODEX-Application-PDUFA-Date-for-Exertional-Heat-Stroke,prev
8/2/17,DRYS,-23.9,-20.23789433,11.90471726,bw,"The Klein Law Firm Reminds Investors of a Class Action Filed on Behalf of DryShips Inc. Shareholders and a Lead Plaintiff Deadline of September 12, 2017","The Klein Law Firm announces that a class action complaint has been filed on behalf of shareholders of DryShips Inc. (NASDAQ:DRYS) who purchased shares between June 8, 2016 and July 12, 2017. The acti...",http://www.businesswire.com/news/home/20170801006295/en/The-Klein-Law-Firm-Reminds-Investors-of-a-Class-Action-Filed-on-Behalf-of-DryShips-Inc.-Shareholders-and-a-Lead-Plaintiff-Deadline-of-September-12-2017,prev
8/8/17,AIRG,-22.6,-23.68231047,0,bw,Airgain Reports Second Quarter 2017 Financial Results,"Airgain, Inc. (NASDAQ: AIRG), Airgain, Inc. (NASDAQ: AIRG), a leading provider of advanced antenna technologies used to enable high performance wireless networking, today reported unaudited results fo...",http://www.businesswire.com/news/home/20170807005897/en/Airgain-Reports-Second-Quarter-2017-Financial-Results,prev
8/8/17,BIOL,-28,-28.04878049,0,bw,BIOLASE Reports 2017 Second Quarter and Six-Month Results,"BIOLASE, Inc. (NASDAQ:BIOL), the global leader in dental lasers, today reported its financial results for its second quarter and six months ended June 30, 2017. Waterlase Express™ placements continued...",http://www.businesswire.com/news/home/20170807005780/en/BIOLASE-Reports-2017-Second-Quarter-and-Six-Month-Results,prev
8/10/17,BW,-72.3,-47.87644788,0.193050193,bw,Babcock & Wilcox Announces Second Quarter 2017 Results,"Babcock & Wilcox Enterprises, Inc. (""B&W"") (NYSE: BW) announced today second quarter 2017 revenues of $349.8 million, a decrease of $33.4 million, or 8.7%, compared to the second quarter of 20...",http://www.businesswire.com/news/home/20170809006125/en/Babcock-Wilcox-Announces-Second-Quarter-2017-Results,prev
9/11/17,HIIQ,-21.9,-21.90635452,0,bw,"EQUITY ALERT: Rosen Law Firm Files Securities Class Action Lawsuit Against Health Insurance Innovations, Inc. – HIIQ","Rosen Law Firm, a global investor rights law firm, announces it has filed a class action lawsuit on behalf of purchasers of the securities of Health Insurance Innovations, Inc. (NASDAQ:HIIQ) from Augu...",http://www.businesswire.com/news/home/20170911006348/en/EQUITY-ALERT-Rosen-Law-Firm-Files-Securities-Class-Action-Lawsuit-Against-Health-Insurance-Innovations-Inc.-%E2%80%93-HIIQ,same
9/11/17,HIIQ,-21.9,-21.90635452,0,bw,"SHAREHOLDER ALERT: Levi & Korsinsky, LLP Notifies Investors of an Investigation Involving Possible Securities Fraud Violations by the Board of Directors of Health Insurance Innovations, Inc.","Levi & Korsinsky announces it has commenced an investigation of Health Insurance Innovations, Inc. (“Health Insurance” or the “Company”) (NASDAQ:HIIQ) concerning possible violations of federal sec...",http://www.businesswire.com/news/home/20170911006315/en/SHAREHOLDER-ALERT-Levi-Korsinsky-LLP-Notifies-Investors-of-an-Investigation-Involving-Possible-Securities-Fraud-Violations-by-the-Board-of-Directors-of-Health-Insurance-Innovations-Inc.,same
9/11/17,HIIQ,-21.9,-21.90635452,0,bw,"INVESTOR ALERT: Law Offices of Howard G. Smith Commences Investigation on Behalf of Health Insurance Innovations, Inc. Investors (HIIQ)","Law Offices of Howard G. Smith announces an investigation on behalf of Health Insurance Innovations, Inc. (the “Company”) (NASDAQ: HIIQ) investors concerning the Company and its officers’ possible vio...",http://www.businesswire.com/news/home/20170911006113/en/INVESTOR-ALERT-Law-Offices-of-Howard-G.-Smith-Commences-Investigation-on-Behalf-of-Health-Insurance-Innovations-Inc.-Investors-HIIQ,same
9/11/17,HIIQ,-21.9,-21.90635452,0,bw,INVESTOR ALERT: Investigation of Health Insurance Innovations Announced by Holzer & Holzer,"Holzer & Holzer, LLC is investigating whether Health Insurance Innovations, Inc. (“Health Insurance Innovations” or the “Company”) (NASDAQ: HIIQ) complied with the federal securities laws. The Com...",http://www.businesswire.com/news/home/20170911006057/en/INVESTOR-ALERT-Investigation-of-Health-Insurance-Innovations-Announced-by-Holzer-Holzer,same
9/11/17,HIIQ,-21.9,-21.90635452,0,bw,"EQUITY ALERT: Rosen Law Firm Announces Investigation of Securities Claims Against Health Insurance Innovations, Inc. – HIIQ","Rosen Law Firm, a global investor rights law firm, announces it is investigating potential securities claims on behalf of shareholders of Health Insurance Innovations, Inc. (NASDAQ:HIIQ) resulting fro...",http://www.businesswire.com/news/home/20170911005780/en/EQUITY-ALERT-Rosen-Law-Firm-Announces-Investigation-of-Securities-Claims-Against-Health-Insurance-Innovations-Inc.-%E2%80%93-HIIQ,same
10/9/17,TNDM,-29.1,-22.52,0,bw,Tandem Diabetes Care Announces Approval of Reverse Stock Split,"Tandem Diabetes Care®, Inc. (NASDAQ: TNDM) previously announced that a proposal was approved at its Special Meeting of Stockholders, held September 7, 2017, authorizing its Board of Directors to amend...",http://www.businesswire.com/news/home/20171009005339/en/Tandem-Diabetes-Care-Announces-Approval-of-Reverse-Stock-Split,same
11/1/17,FTR,-26.8,-26.53399668,0,bw,Frontier Communications Corporation Declares Fourth-Quarter Dividends,"Frontier Communications Corporation (NASDAQ: FTR) announced today that its Board of Directors has declared a regular quarterly dividend on Frontier’s 11.125% Mandatory Convertible Preferred Stock, Ser...",http://www.businesswire.com/news/home/20171031006506/en/Frontier-Communications-Corporation-Declares-Fourth-Quarter-Dividends,prev
11/1/17,FTR,-26.8,-26.53399668,0,bw,Frontier Communications Reports 2017 Third Quarter Results,"Frontier Communications Corporation (NASDAQ:FTR) today reported financial results for the third quarter ended September 30, 2017. “Our third quarter results highlight the ongoing stabilization across...",http://www.businesswire.com/news/home/20171031006494/en/Frontier-Communications-Reports-2017-Third-Quarter-Results,prev
11/3/17,GNMK,-41.3,-29,2.833333333,bw,"Glancy Prongay & Murray LLP Commences Investigation on Behalf of GenMark Diagnostics, Inc. Investors (GNMK)","Glancy Prongay & Murray LLP (“GPM”) announces an investigation on behalf of GenMark Diagnostics, Inc. (“GenMark” or the “Company”) (NASDAQ: GNMK) investors concerning the Company and its officers’...",http://www.businesswire.com/news/home/20171103005902/en/Glancy-Prongay-Murray-LLP-Commences-Investigation-on-Behalf-of-GenMark-Diagnostics-Inc.-Investors-GNMK,same
11/3/17,GNMK,-41.3,-29,2.833333333,bw,"EQUITY ALERT: Rosen Law Firm Announces Investigation of Securities Claims Against GenMark Diagnostics, Inc. – GNMK","Rosen Law Firm, a global investor rights law firm, announces it is investigating potential securities claims on behalf of purchasers of the securities of GenMark Diagnostics, Inc. (NASDAQ:GNMK) result...",http://www.businesswire.com/news/home/20171103005686/en/EQUITY-ALERT-Rosen-Law-Firm-Announces-Investigation-of-Securities-Claims-Against-GenMark-Diagnostics-Inc.-%E2%80%93-GNMK,same
11/3/17,GNMK,-41.3,-29,2.833333333,bw,GenMark Diagnostics Reports Third Quarter 2017 Results,"GenMark Diagnostics, Inc. (Nasdaq:GNMK), a leading provider of automated, multiplex molecular diagnostic testing systems, today announced financial results for the third quarter ended September 30, 20...",http://www.businesswire.com/news/home/20171102006463/en/GenMark-Diagnostics-Reports-Third-Quarter-2017-Results,prev
11/7/17,FPRX,-40.9,-28.16666667,8.833333333,bw,Five Prime Therapeutics to Host Conference Call on November 8 to Review Cabiralizumab Phase 1a/1b Data,"Five Prime Therapeutics, Inc. (NASDAQ: FPRX), a clinical-stage biotechnology company focused on discovering and developing innovative immuno-oncology protein therapeutics, announced today that it will...",http://www.businesswire.com/news/home/20171107006912/en/Five-Prime-Therapeutics-to-Host-Conference-Call-on-November-8-to-Review-Cabiralizumab-Phase-1a1b-Data,same
11/9/17,KODK,-28.8,-20.43010753,0,bw,Kodak Reports Third-Quarter 2017 Financial Results,"Eastman Kodak Company (NYSE: KODK) today reported financial results for the third quarter 2017, delivering a net loss of $46 million on revenues of $379 million. Highlights include: GAAP net loss of $...",http://www.businesswire.com/news/home/20171108006562/en/Kodak-Reports-Third-Quarter-2017-Financial-Results,prev
1/5/18,KALA,-29.3,-23.40625,0,bw,Kala Pharmaceuticals Announces Topline Results for Two Phase 3 Trials (STRIDE 1 and STRIDE 2) of KPI-121 0.25% in Dry Eye Disease,"Kala Pharmaceuticals, Inc. (NASDAQ:KALA), today announced topline results from its two Phase 3 clinical trials, STRIDE 1 and STRIDE 2 (STRIDE - Short Term Relief In Dry Eye), evaluating the safety and...",http://www.businesswire.com/news/home/20180105005184/en/Kala-Pharmaceuticals-Announces-Topline-Results-for-Two-Phase-3-Trials-STRIDE-1-and-STRIDE-2-of-KPI-121-0.25-in-Dry-Eye-Disease,same
