date,ticker,pct_change_prev_close,day_percent_change,max_day_percent_change,source,title,description,url,same_or_prev
3/17/20,LTRPA,-20.9,-22.28915663,4.825301205,bw,Liberty TripAdvisor Holdings Announces $325 million Investment by Certares,"Liberty TripAdvisor Holdings, Inc. (“Liberty TripAdvisor”) (Nasdaq: LTRPA, LTRPB) announced today that it has entered into an Agreement (“Agreement”) with funds managed by Certares Management LLC (“Ce...",http://www.businesswire.com/news/home/20200316005357/en/Liberty-TripAdvisor-Holdings-Announces-325-million-Investment-by-Certares,prev
3/17/20,AGS,-36.7,-36.74911661,2.826855124,bw,"INVESTOR ALERT: Law Offices of Howard G. Smith Continues Its Investigation of PlayAGS, Inc. (AGS) on Behalf of Investors","Law Offices of Howard G. Smith continues its investigation on behalf PlayAGS, Inc.(“PlayAGS” or the “Company”) (NYSE: AGS) investors concerning the Company and its officers’ possible violations of fed...",http://www.businesswire.com/news/home/20200317005851/en/INVESTOR-ALERT-Law-Offices-of-Howard-G.-Smith-Continues-Its-Investigation-of-PlayAGS-Inc.-AGS-on-Behalf-of-Investors,same
3/18/20,MIK,-35.1,-30.14354067,0,bw,The Michaels Companies Announces Fourth Quarter and Full Year Fiscal 2019 Results,"The Michaels Companies, Inc. (NASDAQ: MIK) today announced financial results for the fourth quarter and full year fiscal 2019 ended February 1, 2020. “Our fourth quarter results were consistent with o...",http://www.businesswire.com/news/home/20200317005115/en/The-Michaels-Companies-Announces-Fourth-Quarter-and-Full-Year-Fiscal-2019-Results,prev
3/18/20,ISEE,-24.5,-20.05649718,3.389830508,bw,IVERIC bio Provides Update on the Initiation of the Second Pivotal Clinical Trial Enrollment for Zimura® in Patients With Geographic Atrophy Secondary to Dry Age-Related Macular Degeneration,"IVERIC bio, Inc. (Nasdaq: ISEE) today announced that due to the threat of the coronavirus (COVID-19) global pandemic, the Company has decided to delay the initiation of enrollment of patients in the s...",http://www.businesswire.com/news/home/20200318005059/en/IVERIC-bio-Provides-Update-on-the-Initiation-of-the-Second-Pivotal-Clinical-Trial-Enrollment-for-Zimura%C2%AE-in-Patients-With-Geographic-Atrophy-Secondary-to-Dry-Age-Related-Macular-Degeneration,same
3/18/20,AGS,-41.3,-40,1.142857143,bw,"INVESTOR ALERT: Law Offices of Howard G. Smith Continues Its Investigation of PlayAGS, Inc. (AGS) on Behalf of Investors","Law Offices of Howard G. Smith continues its investigation on behalf PlayAGS, Inc.(“PlayAGS” or the “Company”) (NYSE: AGS) investors concerning the Company and its officers’ possible violations of fed...",http://www.businesswire.com/news/home/20200317005851/en/INVESTOR-ALERT-Law-Offices-of-Howard-G.-Smith-Continues-Its-Investigation-of-PlayAGS-Inc.-AGS-on-Behalf-of-Investors,prev
3/18/20,WPX,-27.5,-22.42647059,1.470588235,bw,WPX Reducing Activity and Maintaining Free Cash Flow,"WPX Energy (NYSE:WPX) is revising its plan for 2020, cutting $400 million – or approximately 25 percent – of its capital budget, with the flexibility to cut further. “We will continue to assess the ma...",http://www.businesswire.com/news/home/20200317005758/en/WPX-Reducing-Activity-and-Maintaining-Free-Cash-Flow,prev
3/18/20,CRAI,-25.9,-21.51061608,3.028193526,bw,Richard D. Booth Joins Charles River Associates (CRA) Board of Directors,"Charles River Associates (NASDAQ: CRAI), a worldwide leader in providing economic, financial, and management consulting services, announced that its Board of Directors has appointed Richard D. Booth a...",http://www.businesswire.com/news/home/20200318005367/en/Richard-D.-Booth-Joins-Charles-River-Associates-CRA-Board-of-Directors,same
3/18/20,CVGI,-32.2,-27.44186047,8.372093023,bw,"EQUITY ALERT: Rosen Law Firm Announces Investigation of Securities Claims Against Commercial Vehicle Group, Inc. – CVGI","Rosen Law Firm, a global investor rights law firm, announces it is investigating potential securities claims on behalf of shareholders of Commercial Vehicle Group, Inc. (NASDAQ: CVGI) resulting from a...",http://www.businesswire.com/news/home/20200318005411/en/EQUITY-ALERT-Rosen-Law-Firm-Announces-Investigation-of-Securities-Claims-Against-Commercial-Vehicle-Group-Inc.-%E2%80%93-CVGI,same
3/18/20,CVGI,-32.2,-27.44186047,8.372093023,bw,The Law Offices of Frank R. Cruz Announces Investigation on Behalf of Commercial Vehicle Group Inc. Investors (CVGI),"The Law Offices of Frank R. Cruz announces an investigation on behalf of Commercial Vehicle Group Inc. (""Commercial Vehicle Group” or ""the Company"") (NASDAQ: CVGI) investors concerning the Company and...",http://www.businesswire.com/news/home/20200317005790/en/The-Law-Offices-of-Frank-R.-Cruz-Announces-Investigation-on-Behalf-of-Commercial-Vehicle-Group-Inc.-Investors-CVGI,prev
3/18/20,CVGI,-32.2,-27.44186047,8.372093023,bw,"INVESTOR ALERT: Law Offices of Howard G. Smith Announces Investigation of Commercial Vehicle Group, Inc. (CVGI) on Behalf of Investors","Law Offices of Howard G. Smith announces an investigation on behalf Commercial Vehicle Group, Inc. (""Commercial Vehicle Group” or ""the Company"") (NASDAQ: CVGI) investors concerning the Company and its...",http://www.businesswire.com/news/home/20200317005731/en/INVESTOR-ALERT-Law-Offices-of-Howard-G.-Smith-Announces-Investigation-of-Commercial-Vehicle-Group-Inc.-CVGI-on-Behalf-of-Investors,prev
3/18/20,DMAC,-24,-23.50993378,0.662251656,bw,"DiaMedica Therapeutics to Report Fourth Quarter 2019 Financials and Provide a Business Update March 24, 2020","DiaMedica Therapeutics Inc. (Nasdaq: DMAC) today announced that its fourth quarter 2019 financial results will be released after the markets close on Monday, March 23rd. DiaMedica will host a live con...",http://www.businesswire.com/news/home/20200317005072/en/DiaMedica-Therapeutics-to-Report-Fourth-Quarter-2019-Financials-and-Provide-a-Business-Update-March-24-2020,prev
3/18/20,ICHR,-28.2,-20.40598291,2.617521368,bw,Ichor Holdings Provides Fiscal First Quarter Business Update,"Ichor Holdings, Ltd. (NASDAQ: ICHR), a leader in the design, engineering and manufacturing of critical fluid delivery subsystems for semiconductor capital equipment, today provided a business update f...",http://www.businesswire.com/news/home/20200317005819/en/Ichor-Holdings-Provides-Fiscal-First-Quarter-Business-Update,prev
3/18/20,NCLH,-22.5,-20.14388489,2.672147996,bw,INVESTOR ALERT: Law Offices of Howard G. Smith Announces the Filing of a Securities Class Action on Behalf Norwegian Cruise Line Holdings Ltd. (NCLH) Investors,"Law Offices of Howard G. Smith announces that a class action lawsuit has been filed on behalf of investors who purchased Norwegian Cruise Line Holdings Ltd. (""Norwegian"" or the Company"") (NYSE: NCLH)...",http://www.businesswire.com/news/home/20200318005098/en/INVESTOR-ALERT-Law-Offices-of-Howard-G.-Smith-Announces-the-Filing-of-a-Securities-Class-Action-on-Behalf-Norwegian-Cruise-Line-Holdings-Ltd.-NCLH-Investors,same
3/18/20,NCLH,-22.5,-20.14388489,2.672147996,bw,INVESTOR ALERT: Law Offices of Howard G. Smith Announces Investigation of Norwegian Cruise Line Holdings Ltd. (NCLH) on Behalf of Investors,"Law Offices of Howard G. Smith announces an investigation on behalf of Norwegian Cruise Line Holdings Ltd. (""Norwegian"" or ""the Company"") (NYSE: NCLH) investors concerning the Company and its officers...",http://www.businesswire.com/news/home/20200317005252/en/INVESTOR-ALERT-Law-Offices-of-Howard-G.-Smith-Announces-Investigation-of-Norwegian-Cruise-Line-Holdings-Ltd.-NCLH-on-Behalf-of-Investors,prev
3/18/20,GES,-38.1,-28.72727273,9.090909091,bw,"Guess?, Inc. Reports Fourth Quarter Results","Guess?, Inc. (NYSE: GES) today reported financial results for its fourth quarter and fiscal year ended February 1, 2020. Carlos Alberini, Chief Executive Officer, commented, “I am very pleased to repo...",http://www.businesswire.com/news/home/20200318005728/en/Guess-Inc.-Reports-Fourth-Quarter-Results,same
3/18/20,GIII,-38.5,-36.79775281,0,bw,G-III Apparel Group Announces Date for Fourth Quarter and Full Fiscal Year 2020 Results,"G-III Apparel Group, Ltd. (NASDAQ:GIII) announced today that it will release its fourth quarter and full fiscal year fiscal 2020 earnings before the market opens on Thursday, March 19, 2020. Managemen...",http://www.businesswire.com/news/home/20200317005850/en/G-III-Apparel-Group-Announces-Date-for-Fourth-Quarter-and-Full-Fiscal-Year-2020-Results,prev
3/18/20,IBOC,-32.8,-27.82839787,3.606681853,bw,International Bancshares Corporation Announces Cash Dividend,"International Bancshares Corporation (NASDAQ:IBOC) (“IBC”) announced today that on March 16, 2020, IBC’s Board of Directors approved the declaration of a $.55 cents per share cash dividend for shareho...",http://www.businesswire.com/news/home/20200317005593/en/International-Bancshares-Corporation-Announces-Cash-Dividend,prev
3/18/20,I,-27,-21.73913044,2.898550725,bw,Intelsat Selects SpaceX to Launch Intelsat 40e Satellite,Intelsat (NYSE: I) has selected SpaceX as its launch partner for Intelsat 40e (IS-40e). The launch is planned for 2022 on SpaceX’s American-built Falcon 9 launch vehicle. “We look forward to working w...,http://www.businesswire.com/news/home/20200317005400/en/Intelsat-Selects-SpaceX-to-Launch-Intelsat-40e-Satellite,prev
3/18/20,PENN,-38.3,-34.68208093,0,bw,Penn National Gaming to Temporarily Suspend Operations at Its Casinos in Nevada,"Penn National Gaming, Inc. (NASDAQ: PENN) (“Penn National” or the “Company”) announced today that pursuant to an order from Governor Steve Sisolak, it will temporarily suspend operations for thirty da...",http://www.businesswire.com/news/home/20200317005885/en/Penn-National-Gaming-to-Temporarily-Suspend-Operations-at-Its-Casinos-in-Nevada,prev
3/18/20,PENN,-38.3,-34.68208093,0,bw,Penn National Gaming to Temporarily Suspend Operations at Hollywood Casino at Charles Town Races in West Virginia,"Penn National Gaming, Inc. (NASDAQ: PENN) (“Penn National” or the “Company”) announced today that pursuant to an order from Governor Jim Justice, it will temporarily suspend operations at Hollywood Ca...",http://www.businesswire.com/news/home/20200317005878/en/Penn-National-Gaming-to-Temporarily-Suspend-Operations-at-Hollywood-Casino-at-Charles-Town-Races-in-West-Virginia,prev
3/18/20,PENN,-38.3,-34.68208093,0,bw,Penn National Gaming to Temporarily Suspend Operations at Its Casinos in Missouri,"Penn National Gaming, Inc. (NASDAQ: PENN) (“Penn National” or the “Company”) announced today that pursuant to an order from Missouri Gaming Commission (“MGC”) it will temporarily suspend operations at...",http://www.businesswire.com/news/home/20200317005823/en/Penn-National-Gaming-to-Temporarily-Suspend-Operations-at-Its-Casinos-in-Missouri,prev
3/18/20,PENN,-38.3,-34.68208093,0,bw,Penn National Gaming to Suspend Construction of Hollywood Casino Morgantown and Hollywood Casino York in Pennsylvania,"Penn National Gaming, Inc. (NASDAQ: PENN) (“Penn National” or the “Company”) announced today that in response to Governor Tom Wolf’s call for a statewide shutdown of all non-essential business activit...",http://www.businesswire.com/news/home/20200317005633/en/Penn-National-Gaming-to-Suspend-Construction-of-Hollywood-Casino-Morgantown-and-Hollywood-Casino-York-in-Pennsylvania,prev
3/18/20,PENN,-38.3,-34.68208093,0,bw,Penn National Gaming to Temporarily Suspend Operations at Ameristar Casino Council Bluffs in Iowa,"Penn National Gaming, Inc. (NASDAQ: PENN) (“Penn National” or the “Company”) announced today that pursuant to an order from Governor Kim Reynolds, it will temporarily suspend operations at Ameristar C...",http://www.businesswire.com/news/home/20200317005614/en/Penn-National-Gaming-to-Temporarily-Suspend-Operations-at-Ameristar-Casino-Council-Bluffs-in-Iowa,prev
3/18/20,PENN,-38.3,-34.68208093,0,bw,Penn National Gaming to Temporarily Suspend Operations at Hollywood Casino at Kansas Speedway,"Penn National Gaming, Inc. (NASDAQ: PENN) (“Penn National” or the “Company”) announced today that Hollywood Casino at Kansas Speedway received notification from the Kansas Lottery to temporarily suspe...",http://www.businesswire.com/news/home/20200317005571/en/Penn-National-Gaming-to-Temporarily-Suspend-Operations-at-Hollywood-Casino-at-Kansas-Speedway,prev
3/18/20,AL,-31,-23.33333333,3.90070922,bw,Air Lease Corporation Announces Delivery of New Airbus A320-200neo Aircraft to Air Seychelles,"Today Air Lease Corporation (“ALC”) (NYSE: AL) announced the delivery of one new Airbus A320-200neo aircraft on long-term lease to Air Seychelles. Featuring CFM International LEAP-1A26 engines, this a...",http://www.businesswire.com/news/home/20200318005735/en/Air-Lease-Corporation-Announces-Delivery-of-New-Airbus-A320-200neo-Aircraft-to-Air-Seychelles,same
3/18/20,AL,-31,-23.33333333,3.90070922,bw,Air Lease Corporation Announces Lease Placement of Two Airbus A330-200 Aircraft with Nordwind Airlines,Today Air Lease Corporation (“ALC”) (NYSE: AL) announced long-term lease placements for two used Airbus A330-200 aircraft with Nordwind Airlines. Previously on long-term lease from ALC to Vietnam Airl...,http://www.businesswire.com/news/home/20200317005781/en/Air-Lease-Corporation-Announces-Lease-Placement-of-Two-Airbus-A330-200-Aircraft-with-Nordwind-Airlines,prev
3/18/20,CMO,-32.1,-28.36538462,2.163461538,bw,Capstead Mortgage Corporation Provides Financial Update in Light of Market Conditions,Capstead Mortgage Corporation (NYSE: CMO) (“Capstead” or the “Company”) today provided estimates of certain key financial metrics in light of the high levels of market volatility experienced in recent...,http://www.businesswire.com/news/home/20200318005820/en/Capstead-Mortgage-Corporation-Provides-Financial-Update-in-Light-of-Market-Conditions,same
3/18/20,TRTX,-33.3,-32.5,0,bw,"TPG RE Finance Trust, Inc. Declares Cash Dividend of $0.43 Per Share","TPG RE Finance Trust, Inc. (NYSE: TRTX) (“TRTX” or the “Company”) announced that on March 17, 2020, the Company’s Board of Directors declared a cash dividend of $0.43 per share of common stock for the...",http://www.businesswire.com/news/home/20200318005167/en/TPG-RE-Finance-Trust-Inc.-Declares-Cash-Dividend-of-0.43-Per-Share,same
3/18/20,NSP,-31,-26.88322599,3.528423411,bw,Insperity Addresses Cancellation of the Insperity Invitational Amid COVID-19 Concerns,"Insperity, Inc. (NYSE: NSP), a leading provider of human resources and business performance solutions for America’s best businesses, today addressed the cancellation of the Insperity InvitationalTM pr...",http://www.businesswire.com/news/home/20200318005349/en/Insperity-Addresses-Cancellation-of-the-Insperity-Invitational-Amid-COVID-19-Concerns,same
3/18/20,CLDT,-38,-31.51183971,0,bw,Chatham Lodging Trust Temporarily Suspends Dividend to Preserve Shareholder Value,"Chatham Lodging Trust (NYSE: CLDT), a lodging real estate investment trust (REIT) that invests in upscale, extended-stay hotels and premium-branded, select-service hotels and owns 134 hotels wholly or...",http://www.businesswire.com/news/home/20200317005709/en/Chatham-Lodging-Trust-Temporarily-Suspends-Dividend-to-Preserve-Shareholder-Value,prev
3/18/20,LINX,-26.5,-20.19704434,6.157635468,bw,Linx Announces Material Fact – Impacts of COVID-19,"LINX S.A. (B3: LINX3) (NYSE: LINX) informs possible economic and financial impacts arising from the dissemination of the new Coronavirus (COVID-19) around the world. So far, Linx has not suffered any...",http://www.businesswire.com/news/home/20200318005386/en/Linx-Announces-Material-Fact-%E2%80%93-Impacts-of-COVID-19,same
3/18/20,MIC,-29.2,-25.71127503,0,bw,MIC Provides Update on Year-to-Date Operating Performance,Macquarie Infrastructure Corporation (NYSE: MIC) today announced that the performance of its businesses has been consistent with the Company’s expectations over the first ten weeks of 2020. At Interna...,http://www.businesswire.com/news/home/20200318005729/en/MIC-Provides-Update-on-Year-to-Date-Operating-Performance,same
3/18/20,MIC,-29.2,-25.71127503,0,bw,Macquarie Infrastructure Corporation Issues Statement Regarding Cincinnati Bell,Macquarie Infrastructure Corporation (NYSE: MIC) today issued the following statement regarding reports that it was involved in a transaction for Cincinnati Bell. “Macquarie Infrastructure Corporation...,http://www.businesswire.com/news/home/20200317005803/en/Macquarie-Infrastructure-Corporation-Issues-Statement-Regarding-Cincinnati-Bell,prev
3/18/20,GBL,-23.6,-20.93663912,0,bw,GAMCO Announces the Termination of its Modified Dutch Auction Tender Offer,"GAMCO Investors, Inc. (the “Company” or “GAMCO”) (NYSE: GBL) announced today that it has terminated its offer to purchase up to $30,000,000 in aggregate purchase price of its Class A common stock, $0....",http://www.businesswire.com/news/home/20200318005702/en/GAMCO-Announces-the-Termination-of-its-Modified-Dutch-Auction-Tender-Offer,same
3/18/20,GBL,-23.6,-20.93663912,0,bw,GAMCO’s Declassification Proposal Approved at National Fuel Gas Company’s Annual Meeting,"National Fuel Gas Company (NYSE:NFG) (“National Fuel” or the “Company”) held its 2020 Annual Meeting of Stockholders on March 11, 2020 in Naples, Florida. The Company announced that the stockholder pr...",http://www.businesswire.com/news/home/20200317005754/en/GAMCO%E2%80%99s-Declassification-Proposal-Approved-at-National-Fuel-Gas-Company%E2%80%99s-Annual-Meeting,prev
3/19/20,APDN,-21,-23.82271468,23.96121884,bw,Applied DNA Leverages COVID-19 Vaccine Development and Proprietary Linear DNA Manufacturing Capability to Design a High Sensitivity Diagnostic Kit for Virus Detection,"Applied DNA Sciences Inc. (NASDAQ: APDN) (“Applied DNA” or the “Company”) a leader in Polymerase Chain Reaction (PCR)-based DNA manufacturing for product authenticity, traceability solutions, nucleic...",http://www.businesswire.com/news/home/20200319005135/en/Applied-DNA-Leverages-COVID-19-Vaccine-Development-and-Proprietary-Linear-DNA-Manufacturing-Capability-to-Design-a-High-Sensitivity-Diagnostic-Kit-for-Virus-Detection,same
3/19/20,APDN,-21,-23.82271468,23.96121884,bw,Applied DNA COVID-19 Collaboration Partner Takis Biotech Receives Italy Ministry of Health Approval to Begin Testing of a Vaccine Candidate on Pre-clinical Models,"Applied DNA Sciences, Inc. (NASDAQ:APDN) (“Applied DNA”) today announced that its COVID-19 collaboration partner, Takis Biotech, a Rome, Italy-based a company focused on the development of cancer vacc...",http://www.businesswire.com/news/home/20200318005699/en/Applied-DNA-COVID-19-Collaboration-Partner-Takis-Biotech-Receives-Italy-Ministry-of-Health-Approval-to-Begin-Testing-of-a-Vaccine-Candidate-on-Pre-clinical-Models,prev
3/20/20,ATRO,-27.4,-28.16764133,4.678362573,bw,Astronics Introduces Next-Gen Land Mobile Radio Service Monitor,"Astronics Corporation (NASDAQ: ATRO), a leading provider of advanced technologies for global aerospace, defense, and other mission critical industries, announced today the Freedom R8200 Communications...",http://www.businesswire.com/news/home/20200319005710/en/Astronics-Introduces-Next-Gen-Land-Mobile-Radio-Service-Monitor,prev
3/20/20,GIII,-20.4,-25.91687042,10.39119804,bw,"G-III Apparel Group, Ltd. Announces Fourth Quarter and Full-year Fiscal 2020 Results","G-III Apparel Group, Ltd. (NasdaqGS: GIII) today announced operating results for the fourth quarter and full fiscal 2020 year ended January 31, 2020. Net sales for the fiscal year ended January 31, 20...",http://www.businesswire.com/news/home/20200319005079/en/G-III-Apparel-Group-Ltd.-Announces-Fourth-Quarter-and-Full-year-Fiscal-2020-Results,prev
3/20/20,WTRH,-53.1,-39,0,bw,Waitr Expands Partnership with Landry’s,"Waitr Holdings Inc. (Nasdaq: WTRH) (“Waitr” or the “Company”), a leader in on-demand food ordering and delivery, today announced that the Company has expanded its partnership with Landry's, Inc. to a...",http://www.businesswire.com/news/home/20200320005120/en/Waitr-Expands-Partnership-with-Landry%E2%80%99s,same
3/20/20,RTW,-30.4,-27.27272727,9.090909091,bw,"RTW Retailwinds, Inc. Announces Leadership Succession Plan That Accelerates Digital Transformation and Positions the Company for Long Term Profitable Growth","RTW Retailwinds, Inc. (NYSE:RTW), an omni-channel specialty apparel retail platform for powerful celebrity and consumer brands, today announced a leadership succession plan thereby positioning the Com...",http://www.businesswire.com/news/home/20200319005740/en/RTW-Retailwinds-Inc.-Announces-Leadership-Succession-Plan-That-Accelerates-Digital-Transformation-and-Positions-the-Company-for-Long-Term-Profitable-Growth,prev
3/20/20,RTW,-30.4,-27.27272727,9.090909091,bw,"RTW Retailwinds, Inc. Announces 2019 4th Quarter and Full Year Results","RTW Retailwinds, Inc. (NYSE:RTW), an omni-channel specialty apparel retail platform for powerful celebrity and consumer brands, today announced results for the fourth quarter and full year fiscal 2019...",http://www.businesswire.com/news/home/20200319005774/en/RTW-Retailwinds-Inc.-Announces-2019-4th-Quarter-and-Full-Year-Results,prev
3/20/20,RTW,-30.4,-27.27272727,9.090909091,bw,"RTW Retailwinds, Inc. Provides Coronavirus Business Update","RTW Retailwinds, Inc. (NYSE:RTW), today announced that it has temporarily closed all New York & Company and Fashion to Figure stores as of end of business, March 18th, 2020 through March 28th, 202...",http://www.businesswire.com/news/home/20200319005082/en/RTW-Retailwinds-Inc.-Provides-Coronavirus-Business-Update,prev
3/20/20,TPVG,-33.5,-35.80097087,0,bw,TriplePoint Venture Growth BDC Corp. Closes 5-Year Investment Grade Notes Offering Totaling $70.0 Million,"TriplePoint Venture Growth BDC Corp. (NYSE: TPVG) (the “Company,” “TPVG,” “we,” “us,” or “our”), the leading financing provider to venture growth stage companies backed by a select group of venture ca...",http://www.businesswire.com/news/home/20200319005604/en/TriplePoint-Venture-Growth-BDC-Corp.-Closes-5-Year-Investment-Grade-Notes-Offering-Totaling-70.0-Million,prev
3/23/20,TRTX,-29.7,-31.6735823,0.276625173,bw,"TPG RE Finance Trust, Inc. Provides Update","On March 23, 2020, TPG RE Finance Trust, Inc. (NYSE: TRTX) (“TRTX” or the “Company”) announced that the Company’s previously authorized cash dividend for the first quarter of 2020 of $0.43 per share o...",http://www.businesswire.com/news/home/20200323005374/en/TPG-RE-Finance-Trust-Inc.-Provides-Update,same
3/23/20,SIG,-24.5,-24.54780362,1.087855297,bw,Signet Jewelers Provides a COVID-19 Business Update,"Signet Jewelers Limited (“Signet”) (NYSE:SIG), the world's largest retailer of diamond jewelry, today provided an update on its global operations in response to the continued spread and impact of COVI...",http://www.businesswire.com/news/home/20200323005328/en/Signet-Jewelers-Provides-a-COVID-19-Business-Update,same
3/23/20,JMF,-26.8,-25.80645161,0,bw,Nuveen MLP Closed-End Funds Eliminate Leverage,Nuveen Energy MLP Total Return Fund (NYSE: JMF) and the Nuveen All Cap Energy MLP Opportunities Fund (NYSE: JMLP) announced certain changes to the Funds’ strategies in response to recent market condit...,http://www.businesswire.com/news/home/20200323005029/en/Nuveen-MLP-Closed-End-Funds-Eliminate-Leverage,same
3/24/20,MITT,-23.8,-26.4604811,3.611683849,bw,"AG Mortgage Investment Trust, Inc. Provides Update on Status of Financing Arrangements as of March 23, 2020","AG Mortgage Investment Trust, Inc. (NYSE: MITT) (the “Company”) announced today that in recent weeks, due to the turmoil in the financial markets resulting from the global pandemic of the COVID-19 vir...",http://www.businesswire.com/news/home/20200323005273/en/AG-Mortgage-Investment-Trust-Inc.-Provides-Update-on-Status-of-Financing-Arrangements-as-of-March-23-2020,prev
3/24/20,TWO,-39.6,-44.46808511,0.85106383,bw,Two Harbors Investment Corp. Announces Company Update and Suspension of First Quarter 2020 Common and Preferred Stock Dividends,"Two Harbors Investment Corp. (NYSE: TWO) (the “Company”), a leading hybrid mortgage real estate investment trust (REIT), today announced that the Company has suspended both its first quarter 2020 comm...",http://www.businesswire.com/news/home/20200324005791/en/Two-Harbors-Investment-Corp.-Announces-Company-Update-and-Suspension-of-First-Quarter-2020-Common-and-Preferred-Stock-Dividends,same
3/27/20,CHRA,-26.5,-28.69565217,0,bw,"Charah Solutions, Inc. Reports Fourth Quarter and Full Year 2019 Results","Charah Solutions, Inc. (NYSE: CHRA) (together with its subsidiaries, “Charah Solutions,” the “Company,” “we,” “us,” or “our”), a leading provider of environmental and maintenance services to the power...",http://www.businesswire.com/news/home/20200326005275/en/Charah-Solutions-Inc.-Reports-Fourth-Quarter-and-Full-Year-2019-Results,prev
3/27/20,CRC,-46.6,-44.06779661,10.80508475,bw,California Resources Corporation Provides Comment on Market Speculation,"California Resources Corporation (NYSE: CRC), an independent California-based oil and gas exploration and production company, today issued the following statement on media speculation: “Over the past...",http://www.businesswire.com/news/home/20200327005490/en/California-Resources-Corporation-Provides-Comment-on-Market-Speculation,same
3/27/20,RRTS,-34.3,-27.08333333,0,bw,Roadrunner Transportation Systems Reports 2019 Results,"Roadrunner Transportation Systems, Inc. (“Roadrunner” or the “company”) (NYSE: RRTS), a leading asset-right transportation and asset-light logistics service provider, today announced results for the f...",http://www.businesswire.com/news/home/20200326005713/en/Roadrunner-Transportation-Systems-Reports-2019-Results,prev
