date,ticker,pct_change_prev_close,day_percent_change,max_day_percent_change,source,title,description,url,same_or_prev
7/29/16,ITGR,-30.3,-22.55927476,0.383542538,gnw,Integer Holdings Corporation Reports 2016 Second Quarter Results,"FRISCO, Texas, July 28, 2016 (GLOBE NEWSWIRE) -- Integer Holdings Corporation (NYSE:ITGR), today announced results for its second quarter ended July 1, 2016.  Three Months Ended As...",https://www.globenewswire.com/news-release/2016/07/28/859906/26755/en/Integer-Holdings-Corporation-Reports-2016-Second-Quarter-Results.html,prev
4/28/17,BCEI,-35.3,-35.26468213,32.03491798,gnw,Bonanza Creek Energy Successfully Completes Prepackaged Financial Restructuring; Emerges From Chapter 11; Announces New Board of Directors,"DENVER, April 28, 2017 (GLOBE NEWSWIRE) -- Bonanza Creek Energy, Inc. (NYSE:BCEI) (“Bonanza Creek” or the “Company”) today announced that in accordance with and pursuant to its Plan of...",https://www.globenewswire.com/news-release/2017/04/28/974578/0/en/Bonanza-Creek-Energy-Successfully-Completes-Prepackaged-Financial-Restructuring-Emerges-From-Chapter-11-Announces-New-Board-of-Directors.html,same
4/28/17,BCEI,-35.3,-35.26468213,32.03491798,gnw,Bonanza Creek to Continue Listing New Shares of Common Stock Under Ticker “BCEI” Following Emergence From Chapter 11 Reorganization,"DENVER, April 27, 2017 (GLOBE NEWSWIRE) -- Bonanza Creek Energy, Inc. (NYSE:BCEI) (“Bonanza Creek” or the “Company”) today announced that the Company received approval to list its new common stock...",https://www.globenewswire.com/news-release/2017/04/27/973443/0/en/Bonanza-Creek-to-Continue-Listing-New-Shares-of-Common-Stock-Under-Ticker-BCEI-Following-Emergence-From-Chapter-11-Reorganization.html,prev
11/9/17,SQBG,-38.8,-34.09090909,1.136363636,gnw,Sequential Brands Group Announces Third Quarter 2017 Financial Results,"NEW YORK, Nov. 09, 2017 (GLOBE NEWSWIRE) -- Sequential Brands Group, Inc. (“Sequential” or the “Company”) (Nasdaq:SQBG) today announced financial results for the quarter and nine months ended...",https://www.globenewswire.com/news-release/2017/11/09/1178585/25123/en/Sequential-Brands-Group-Announces-Third-Quarter-2017-Financial-Results.html,same
1/29/18,FWP,-27.8,-29.76406534,1.667876588,gnw,Forward Pharma Announces the Decision of the European Patent Office in the Opposition Proceedings for the EP2801355 Patent,"COPENHAGEN, Denmark, Jan. 29, 2018 (GLOBE NEWSWIRE) -- Forward Pharma A/S (NASDAQ:FWP) (“Forward” or the “Company”) today announced that the European Patent Office (the “EPO”) has revoked the...",https://www.globenewswire.com/news-release/2018/01/29/1313698/33673/en/Forward-Pharma-Announces-the-Decision-of-the-European-Patent-Office-in-the-Opposition-Proceedings-for-the-EP2801355-Patent.html,same
4/3/18,AIPT,-27.7,-24.29906542,0,gnw,Precision Therapeutics Reports Fiscal Year 2017 Financial Results,"MINNEAPOLIS, April 02, 2018 (GLOBE NEWSWIRE) -- Precision Therapeutics Inc. (NASDAQ:AIPT) (“Precision” or “the Company”), formerly Skyline Medical, a company focused on applying artificial...",https://www.globenewswire.com/news-release/2018/04/02/1458704/37244/en/Precision-Therapeutics-Reports-Fiscal-Year-2017-Financial-Results.html,prev
6/20/18,GEVO,-35.7,-33.17333333,0,gnw,Gevo Regains Compliance with NASDAQ Minimum Bid Price Listing Requirement,"ENGLEWOOD, Colo., June 19, 2018 (GLOBE NEWSWIRE) -- Gevo, Inc. (NASDAQ:GEVO) announced today that it has received a letter from The NASDAQ Stock Market LLC notifying the Company that it has regained...",https://www.globenewswire.com/news-release/2018/06/19/1526537/23976/en/Gevo-Regains-Compliance-with-NASDAQ-Minimum-Bid-Price-Listing-Requirement.html,prev
7/31/18,GDS,-37.2,-38.07092199,1.163120567,gnw,"GDS to Report Second Quarter 2018 Financial Results on Tuesday, August 14, 2018","SHANGHAI, China, July 31, 2018 (GLOBE NEWSWIRE) -- GDS Holdings Limited (“GDS Holdings,” “GDS” or the “Company”) (NASDAQ: GDS), a leading developer and operator of high-performance data centers in...",https://www.globenewswire.com/news-release/2018/07/31/1544394/0/en/GDS-to-Report-Second-Quarter-2018-Financial-Results-on-Tuesday-August-14-2018.html,same
8/6/18,HAIR,-28.6,-23.77358491,0,gnw,Restoration Robotics™ Announces Proposed Public Offering of Common Stock,"SAN JOSE, Calif., Aug. 06, 2018 (GLOBE NEWSWIRE) -- Restoration Robotics™, Inc. (NASDAQ: HAIR) today announced that it has commenced an underwritten public offering of up to $25,000,000 of shares of...",https://www.globenewswire.com/news-release/2018/08/06/1547346/0/en/Restoration-Robotics-Announces-Proposed-Public-Offering-of-Common-Stock.html,same
8/7/18,GEMP,-50.5,-24.53222453,1.455301455,gnw,Gemphire Announces Amended and Restated Gemcabene License Agreement with Pfizer Inc.,"LIVONIA, Mich., Aug. 06, 2018 (GLOBE NEWSWIRE) -- Gemphire Therapeutics Inc. (NASDAQ: GEMP), a clinical-stage biopharmaceutical company focused on developing and commercializing therapies for...",https://www.globenewswire.com/news-release/2018/08/06/1547658/0/en/Gemphire-Announces-Amended-and-Restated-Gemcabene-License-Agreement-with-Pfizer-Inc.html,prev
8/16/18,ESES,-26.7,-26.66666667,0,gnw,"Eco-Stim Energy Solutions Announces Participation in Enercom's ""The Oil & Gas Conference"" to be held in Denver August 19-23, 2018","HOUSTON, TEXAS, Aug. 15, 2018 (GLOBE NEWSWIRE) -- Eco-Stim Energy Solutions, Inc. (NASDAQ: ESES) (“EcoStim” or the “Company”) announced today that J. Chris Boswell, the Company’s President and Chief...",https://www.globenewswire.com/news-release/2018/08/15/1552642/29377/en/Eco-Stim-Energy-Solutions-Announces-Participation-in-Enercom-s-The-Oil-Gas-Conference-to-be-held-in-Denver-August-19-23-2018.html,prev
9/21/18,DTEA,-25.4,-49.4949495,8.080808081,gnw,DAVIDsTEA Comments on Trading Activity,"MONTREAL, Sept. 21, 2018 (GLOBE NEWSWIRE) -- In light of the recent significant increase in the price of its shares and in trading volume, DAVIDsTEA Inc. (Nasdaq: DTEA) wishes to confirm that it is...",https://www.globenewswire.com/news-release/2018/09/21/1574407/0/en/DAVIDsTEA-Comments-on-Trading-Activity.html,same
9/25/18,TGTX,-44.3,-21.96969697,1.515151515,gnw,TG Therapeutics Announces Update Regarding UNITY-CLL Phase 3 Trial,"NEW YORK, Sept. 25, 2018 (GLOBE NEWSWIRE) -- TG Therapeutics (NASDAQ: TGTX) today announced that the independent Data Safety Monitoring Board (DSMB) for the UNITY-CLL Phase 3 trial met to review...",https://www.globenewswire.com/news-release/2018/09/25/1575546/8790/en/TG-Therapeutics-Announces-Update-Regarding-UNITY-CLL-Phase-3-Trial.html,same
9/25/18,FPAY,-37.1,-36.41304348,0,gnw,"FlexShopper, Inc. Announces Pricing of $10,000,000 Million Public Offering","BOCA RATON, Fla., Sept. 25, 2018 (GLOBE NEWSWIRE) -- FlexShopper, Inc. (NASDAQ: FPAY) (“the Company”), a leader in virtual lease-to-own transactions occurring outside of traditional brick and mortar...",https://www.globenewswire.com/news-release/2018/09/25/1576118/29694/en/FlexShopper-Inc-Announces-Pricing-of-10-000-000-Million-Public-Offering.html,same
9/25/18,FPAY,-37.1,-36.41304348,0,gnw,"FlexShopper, Inc. Awarded Patent for LTO System","BOCA RATON, Fla., Sept. 24, 2018 (GLOBE NEWSWIRE) -- FlexShopper, Inc. (Nasdaq: FPAY, “FlexShopper”), a leading national online lease-to-own (“LTO”) retailer and LTO payment solution provider,...",https://www.globenewswire.com/news-release/2018/09/24/1574954/29694/en/FlexShopper-Inc-Awarded-Patent-for-LTO-System.html,prev
10/9/18,ABUS,-34,-33.25917686,0,gnw,Arbutus Provides Update on HBV Development Programs and Announces Appointment of Dr. Gaston Picchio as Chief Development Officer,"WARMINSTER, Pa., Oct. 09, 2018 (GLOBE NEWSWIRE) -- Arbutus Biopharma Corporation (Nasdaq: ABUS), an industry-leading Hepatitis B Virus (HBV) therapeutic solutions company, today announced a change...",https://www.globenewswire.com/news-release/2018/10/09/1618499/14025/en/Arbutus-Provides-Update-on-HBV-Development-Programs-and-Announces-Appointment-of-Dr-Gaston-Picchio-as-Chief-Development-Officer.html,same
10/10/18,ABUS,-23.8,-23.06397306,2.777777778,gnw,Arbutus Provides Update on HBV Development Programs and Announces Appointment of Dr. Gaston Picchio as Chief Development Officer,"WARMINSTER, Pa., Oct. 09, 2018 (GLOBE NEWSWIRE) -- Arbutus Biopharma Corporation (Nasdaq: ABUS), an industry-leading Hepatitis B Virus (HBV) therapeutic solutions company, today announced a change...",https://www.globenewswire.com/news-release/2018/10/09/1618499/14025/en/Arbutus-Provides-Update-on-HBV-Development-Programs-and-Announces-Appointment-of-Dr-Gaston-Picchio-as-Chief-Development-Officer.html,prev
10/16/18,HDSN,-31.6,-28.04273504,0,gnw,Hudson Technologies Enters Into Extension Letter Related to Interim Waiver and Second Amendment to Its Term Loan Credit and Security Agreement,"PEARL RIVER, N.Y., Oct. 15, 2018 (GLOBE NEWSWIRE) -- Hudson Technologies, Inc. (NASDAQ: HDSN) today announced that it has entered into an Extension Letter related to its interim Waiver and Second...",https://www.globenewswire.com/news-release/2018/10/15/1621602/0/en/Hudson-Technologies-Enters-Into-Extension-Letter-Related-to-Interim-Waiver-and-Second-Amendment-to-Its-Term-Loan-Credit-and-Security-Agreement.html,prev
10/26/18,AMRH,-20.7,-23,6,gnw,Ameri100 Broadens Solutions Portfolio With Partnership With Virtual and Augmented Reality Company The Glimpse Group,"ATLANTA, GA., Oct. 25, 2018 (GLOBE NEWSWIRE) -- AMERI Holdings, Inc. (NASDAQ: AMRH) (“Ameri100” or the “Company”), a specialized SAP® cloud, digital and enterprise services company, today announced...",https://www.globenewswire.com/news-release/2018/10/25/1626931/0/en/Ameri100-Broadens-Solutions-Portfolio-With-Partnership-With-Virtual-and-Augmented-Reality-Company-The-Glimpse-Group.html,prev
11/1/18,YRCW,-25.8,-26.14457831,2.16626506,gnw,YRC Freight Professional Drivers Russ James and Jeff Rose Chosen as Finalists for the Next ATA Road Team,"OVERLAND PARK, Kan., Nov. 01, 2018 (GLOBE NEWSWIRE) -- (NASDAQ: YRCW). YRC Freight is proud to announce that professional drivers Russ James and Jeff Rose are finalists in the American Trucking...",https://www.globenewswire.com/news-release/2018/11/01/1641618/0/en/YRC-Freight-Professional-Drivers-Russ-James-and-Jeff-Rose-Chosen-as-Finalists-for-the-Next-ATA-Road-Team.html,same
11/1/18,YRCW,-25.8,-26.14457831,2.16626506,gnw,YRC Worldwide Reports Third Quarter 2018 Results,"Results include Operating Income of $41.2 million and Adjusted EBITDA of $84.2 million OVERLAND PARK, Kan., Nov. 01, 2018 (GLOBE NEWSWIRE) -- YRC Worldwide Inc. (NASDAQ: YRCW) reported...",https://www.globenewswire.com/news-release/2018/11/01/1641163/28534/en/YRC-Worldwide-Reports-Third-Quarter-2018-Results.html,same
11/1/18,CSV,-21.5,-20.28753994,0,gnw,Carriage Services Announces Third Quarter 2018 Results,"HOUSTON, Oct. 31, 2018 (GLOBE NEWSWIRE) -- Carriage Services, Inc. (NYSE: CSV) today announced results for the third quarter ended September 30, 2018, shown below: Three Months Ended September 30,...",https://www.globenewswire.com/news-release/2018/10/31/1640674/0/en/Carriage-Services-Announces-Third-Quarter-2018-Results.html,prev
11/2/18,INPX,-32.1,-31.09589041,27.26027397,gnw,Inpixon Announces Reverse Stock Split for NASDAQ Compliance,"PALO ALTO, Calif., Nov. 01, 2018 (GLOBE NEWSWIRE) -- Inpixon (NASDAQ: INPX), a leading indoor positioning and data analytics company, today announced that the Company’s Board of Directors has...",https://www.globenewswire.com/news-release/2018/11/01/1641500/0/en/Inpixon-Announces-Reverse-Stock-Split-for-NASDAQ-Compliance.html,prev
11/2/18,TRVN,-32.4,-32.39047619,42.85714286,gnw,Trevena Receives Complete Response Letter for Oliceridine from FDA,"Company to host conference call and webcast on November 5th CHESTERBROOK, Pa., Nov. 02, 2018 (GLOBE NEWSWIRE) -- Trevena, Inc. (NASDAQ: TRVN) today announced the Company has received a Complete...",https://www.globenewswire.com/news-release/2018/11/02/1642329/0/en/Trevena-Receives-Complete-Response-Letter-for-Oliceridine-from-FDA.html,same
11/8/18,DXYN,-24.8,-24.8,0,gnw,"The Dixie Group reports Third Quarter 2018 Results, Continues the Rollout of Its $11 Million Profit Improvement Plan","DALTON, Ga., Nov. 08, 2018 (GLOBE NEWSWIRE) -- The Dixie Group, Inc. (NASDAQ: DXYN) today reported financial results for the quarter ended September 29, 2018. For the third quarter of 2018, the...",https://www.globenewswire.com/news-release/2018/11/08/1647688/0/en/The-Dixie-Group-reports-Third-Quarter-2018-Results-Continues-the-Rollout-of-Its-11-Million-Profit-Improvement-Plan.html,same
11/12/18,HDSN,-40.3,-27.65531062,0,gnw,Hudson Technologies Files Extension for Quarterly Report Form 10-Q Filing,"Provides Preliminary Fiscal Third Quarter 2018 Revenue Data PEARL RIVER, N.Y., Nov. 12, 2018 (GLOBE NEWSWIRE) -- Hudson Technologies, Inc. (NASDAQ: HDSN) announced that it has filed a Form 12b-25...",https://www.globenewswire.com/news-release/2018/11/12/1649675/0/en/Hudson-Technologies-Files-Extension-for-Quarterly-Report-Form-10-Q-Filing.html,same
11/14/18,RESN,-42.2,-33.2,0.4,gnw,Resonant Inc. Reports Third Quarter 2018 Financial Results and Provides Business Update,"GOLETA, Calif., Nov. 13, 2018 (GLOBE NEWSWIRE) -- Resonant Inc. (NASDAQ: RESN), a leader in transforming the way radio frequency, or RF, front-ends are being designed and delivered for mobile...",https://www.globenewswire.com/news-release/2018/11/13/1650915/0/en/Resonant-Inc-Reports-Third-Quarter-2018-Financial-Results-and-Provides-Business-Update.html,prev
11/14/18,MNGA,-26.8,-26.81395349,12.79069767,gnw,MagneGas Provides Business Update for the Third Quarter of 2018,"More than 195% Quarterly Revenue Increase from Last Year TAMPA, Fla., Nov. 14, 2018 (GLOBE NEWSWIRE) -- MagneGas Applied Technology Solutions, Inc. (""MagneGas"" or the ""Company"") (NASDAQ: MNGA), a...",https://www.globenewswire.com/news-release/2018/11/14/1651356/0/en/MagneGas-Provides-Business-Update-for-the-Third-Quarter-of-2018.html,same
11/15/18,RVLT,-39.3,-29.15833333,0,gnw,Company Receives Updated Proposal,"STAMFORD, Conn., Nov. 14, 2018 (GLOBE NEWSWIRE) -- Revolution Lighting Technologies, Inc. (NASDAQ: RVLT) (“Revolution Lighting” or the “Company”), a global provider of advanced LED lighting...",https://www.globenewswire.com/news-release/2018/11/15/1651910/35010/en/Company-Receives-Updated-Proposal.html,prev
11/15/18,IPWR,-24.5,-22.1,12,gnw,Ideal Power Reports Third Quarter 2018 Financial Results,"Management to Host Conference Call Today at 10:30 a.m. ET AUSTIN, Texas, Nov. 15, 2018 (GLOBE NEWSWIRE) -- Ideal Power Inc. (NASDAQ: IPWR), an innovative power conversion technology company,...",https://www.globenewswire.com/news-release/2018/11/15/1652290/0/en/Ideal-Power-Reports-Third-Quarter-2018-Financial-Results.html,same
11/20/18,CGIX,-33.9,-33.88704319,9.080841639,gnw,Cancer Genetics Reports Third Quarter 2018 Financial Results and Provides Strategic Business Updates,"RUTHERFORD, N.J., Nov. 19, 2018 (GLOBE NEWSWIRE) -- Cancer Genetics, Inc. (Nasdaq: CGIX), a leader in enabling precision medicine for immuno-oncology and genomic medicine through molecular markers...",https://www.globenewswire.com/news-release/2018/11/19/1654092/27455/en/Cancer-Genetics-Reports-Third-Quarter-2018-Financial-Results-and-Provides-Strategic-Business-Updates.html,prev
11/21/18,ANY,-36.5,-35.38461539,10.46153846,gnw,Sphere 3D Regains Compliance with NASDAQ Minimum Bid Price Listing Requirements,"TORONTO, Nov. 21, 2018 (GLOBE NEWSWIRE) -- Sphere 3D Corp. (NASDAQ: ANY), a containerization, virtualization and data management solution provider, today announced that it received written notice...",https://www.globenewswire.com/news-release/2018/11/21/1655350/0/en/Sphere-3D-Regains-Compliance-with-NASDAQ-Minimum-Bid-Price-Listing-Requirements.html,same
11/27/18,SMSH,-40.1,-40,0,gnw,"SMAAASH Entertainment to Present at the 11th Annual LD Micro Main Event on December 4, 2018","NEW YORK, Nov. 27, 2018 (GLOBE NEWSWIRE) -- SMAAASH Entertainment, Inc. (NASDAQ: SMSH) (“SMAAASH” or the “Company”), a global virtual reality gaming and fully integrated eSports platform company,...",https://www.globenewswire.com/news-release/2018/11/27/1657457/0/en/SMAAASH-Entertainment-to-Present-at-the-11th-Annual-LD-Micro-Main-Event-on-December-4-2018.html,same
11/28/18,EVLV,-37,-22.2,2.352941176,gnw,Evine Live Inc. Reports Third Quarter 2018 Results,"MINNEAPOLIS, Nov. 28, 2018 (GLOBE NEWSWIRE) -- Evine Live Inc. (“Evine”) (NASDAQ: EVLV) today announced results for the third quarter ended November 3, 2018. Fiscal Year 2018 Third Quarter Summary ...",https://www.globenewswire.com/news-release/2018/11/28/1658043/0/en/Evine-Live-Inc-Reports-Third-Quarter-2018-Results.html,same
12/3/18,BPTH,-22.1,-20.55235903,6.156501726,gnw,Bio-Path Holdings Presents Interim Data from Phase 2 Study Evaluating Prexigebersen as a Treatment for Acute Myeloid Leukemia at the 60th Annual American Society of Hematology Annual Meeting,"HOUSTON, Dec. 03, 2018 (GLOBE NEWSWIRE) -- Bio-Path Holdings, Inc., (NASDAQ: BPTH), a biotechnology company leveraging its proprietary DNAbilize® antisense RNAi nanoparticle technology to develop a...",https://www.globenewswire.com/news-release/2018/12/03/1660681/0/en/Bio-Path-Holdings-Presents-Interim-Data-from-Phase-2-Study-Evaluating-Prexigebersen-as-a-Treatment-for-Acute-Myeloid-Leukemia-at-the-60th-Annual-American-Society-of-Hematology-Annu.html,same
12/7/18,DMAC,-47,-22.5,6.25,gnw,DIAMEDICA ANNOUNCES PRICING OF INITIAL PUBLIC OFFERING AND NASDAQ LISTING,"MINNEAPOLIS, Dec. 07, 2018 (GLOBE NEWSWIRE) -- DiaMedica Therapeutics Inc. (“DiaMedica”) (NASDAQ:DMAC) (TSX‑V:DMA), a clinical stage biopharmaceutical company, announced today the pricing of its...",https://www.globenewswire.com/news-release/2018/12/07/1663697/0/en/DIAMEDICA-ANNOUNCES-PRICING-OF-INITIAL-PUBLIC-OFFERING-AND-NASDAQ-LISTING.html,same
12/14/18,YRCW,-28.4,-28.11791383,1.814058957,gnw,YRC Freight Statement on U.S. Government Litigation,"OVERLAND PARK, Kan., Dec. 14, 2018 (GLOBE NEWSWIRE) -- (NASDAQ: YRCW) -- After more than 9 years of diligently cooperating with the federal government’s inquiries, YRC Freight was informed that the...",https://www.globenewswire.com/news-release/2018/12/14/1667471/0/en/YRC-Freight-Statement-on-U-S-Government-Litigation.html,same
12/17/18,CGIX,-40,-37.88727137,0.709219858,gnw,Cancer Genetics Terminates Proposed Merger with NovellusDx,"RUTHERFORD, N.J., Dec. 17, 2018 (GLOBE NEWSWIRE) -- Cancer Genetics, Inc. (Nasdaq: CGIX), a leader in enabling precision medicine for immuno-oncology and genomic medicine through molecular markers...",https://www.globenewswire.com/news-release/2018/12/17/1667894/27455/en/Cancer-Genetics-Terminates-Proposed-Merger-with-NovellusDx.html,same
12/20/18,EQ,-36.1,-36.73673674,0.500500501,gnw,Equillium Granted U.S. FDA Fast Track Designation for EQ001 for the Treatment of Acute Graft-Versus-Host Disease,"LA JOLLA, Calif., Dec. 19, 2018 (GLOBE NEWSWIRE) -- Equillium, Inc. (Nasdaq: EQ), a biotechnology company developing treatments for severe immuno-inflammatory disorders, today announced that the...",https://www.globenewswire.com/news-release/2018/12/19/1669475/0/en/Equillium-Granted-U-S-FDA-Fast-Track-Designation-for-EQ001-for-the-Treatment-of-Acute-Graft-Versus-Host-Disease.html,prev
12/20/18,AMSC,-21.1,-21.16788321,1.135442011,gnw,AMSC Delivers VVO to New England Utility,"AYER, Mass., Dec. 20, 2018 (GLOBE NEWSWIRE) -- AMSC (NASDAQ: AMSC), a global energy solutions provider serving wind and power grid industry leaders, today announced the delivery of AMSC’s D-VAR VVO®...",https://www.globenewswire.com/news-release/2018/12/20/1670342/18367/en/AMSC-Delivers-VVO-to-New-England-Utility.html,same
12/21/18,FBIO,-23.6,-24.61333333,0.026666667,gnw,Fortress Biotech Recaps Corporate Highlights and Achievements in 2018,"NEW YORK, Dec. 21, 2018 (GLOBE NEWSWIRE) -- Fortress Biotech, Inc. (NASDAQ: FBIO) (“Fortress”), a biopharmaceutical company dedicated to acquiring, developing and commercializing novel...",https://www.globenewswire.com/news-release/2018/12/21/1677869/28889/en/Fortress-Biotech-Recaps-Corporate-Highlights-and-Achievements-in-2018.html,same
12/21/18,EDIT,-20.8,-20.39387309,0.218818381,gnw,Editas Medicine Announces Transition of Chief Financial Officer,"CAMBRIDGE, Mass., Dec. 21, 2018 (GLOBE NEWSWIRE) -- Editas Medicine, Inc. (NASDAQ: EDIT), a leading genome editing company, today announced that its Chief Financial Officer, Andrew Hack, M.D.,...",https://www.globenewswire.com/news-release/2018/12/21/1677706/0/en/Editas-Medicine-Announces-Transition-of-Chief-Financial-Officer.html,same
1/7/19,AXGN,-23.2,-20.9178744,1.449275362,gnw,"AxoGen Appoints Christopher Crisman as Vice President, U.S. Sales"," ALACHUA, Fla., Jan. 07, 2019 (GLOBE NEWSWIRE) -- AxoGen, Inc. (NASDAQ: AXGN), a global leader in developing and marketing innovative surgical solutions for damage or discontinuity to...",https://www.globenewswire.com/news-release/2019/01/07/1681344/0/en/AxoGen-Appoints-Christopher-Crisman-as-Vice-President-U-S-Sales.html,same
1/18/19,BPTH,-30.6,-36.82310469,83.03249098,gnw,"Bio-Path Holdings, Inc. Announces $1.7 Million Registered Direct Offering Priced At-the-Market","HOUSTON, Jan. 18, 2019 (GLOBE NEWSWIRE) -- Bio-Path Holdings, Inc., (Nasdaq: BPTH) (Bio-Path),  a biotechnology company leveraging its proprietary DNAbilize® antisense RNAi nanoparticle technology...",https://www.globenewswire.com/news-release/2019/01/18/1702093/0/en/Bio-Path-Holdings-Inc-Announces-1-7-Million-Registered-Direct-Offering-Priced-At-the-Market.html,same
1/18/19,BPTH,-30.6,-36.82310469,83.03249098,gnw,Bio-Path Holdings Announces 1-for-20 Reverse Stock Split,"HOUSTON, Jan. 18, 2019 (GLOBE NEWSWIRE) -- Bio-Path Holdings, Inc. (NASDAQ: BPTH), a biotechnology company leveraging its proprietary DNAbilize® antisense RNAi nanoparticle technology to develop a...",https://www.globenewswire.com/news-release/2019/01/18/1701901/0/en/Bio-Path-Holdings-Announces-1-for-20-Reverse-Stock-Split.html,same
1/18/19,BPTH,-30.6,-36.82310469,83.03249098,gnw,"Bio-Path Holdings, Inc. Announces Closing of Public Offering of Common Stock","HOUSTON, Jan. 17, 2019 (GLOBE NEWSWIRE) -- Bio-Path Holdings, Inc., (Nasdaq: BPTH) (Bio-Path), a biotechnology company leveraging its proprietary DNAbilize® antisense RNAi nanoparticle technology to...",https://www.globenewswire.com/news-release/2019/01/17/1701656/0/en/Bio-Path-Holdings-Inc-Announces-Closing-of-Public-Offering-of-Common-Stock.html,prev
1/30/19,NFEC,-21.5,-24.74916388,1.114827202,gnw,NF Energy Accepts Action by Written Consent of the Stockholders and Changes to the Board of Directors,"SHENYANG, China, Jan. 30, 2019 (GLOBE NEWSWIRE) -- NF Energy Saving Corporation. (NASDAQ:NFEC) (""NF Energy"" or the ""Company""), a leading energy saving services and solutions provider for China's...",https://www.globenewswire.com/news-release/2019/01/30/1707713/0/en/NF-Energy-Accepts-Action-by-Written-Consent-of-the-Stockholders-and-Changes-to-the-Board-of-Directors.html,same
2/7/19,MNGA,-22.7,-21.72131148,0.409836066,gnw,"Taronis Technologies Announces Proposed Public Offering of Common Stock, Pre-Funded Warrants and Warrants","TAMPA, Fla., Feb. 07, 2019 (GLOBE NEWSWIRE) -- Taronis Technologies, Inc. (“Taronis"") or the ""Company"") (Nasdaq: MNGA), a clean technology company in the renewable resources and environmental...",https://www.globenewswire.com/news-release/2019/02/07/1713759/0/en/Taronis-Technologies-Announces-Proposed-Public-Offering-of-Common-Stock-Pre-Funded-Warrants-and-Warrants.html,same
2/19/19,IEA,-25.9,-24.48484849,1.747878788,gnw,"Infrastructure and Energy Alternatives, Inc. Preannounces Pro Forma Full Year 2018 Results","INDIANAPOLIS, Feb. 19, 2019 (GLOBE NEWSWIRE) -- Infrastructure and Energy Alternatives, Inc. (NASDAQ: IEA) (“IEA” or the “Company”), a leading infrastructure construction company with specialized...",https://www.globenewswire.com/news-release/2019/02/19/1734038/0/en/Infrastructure-and-Energy-Alternatives-Inc-Preannounces-Pro-Forma-Full-Year-2018-Results.html,same
2/21/19,WIN,-26,-24.82677165,0.787401575,gnw,Windstream completes broadband speed upgrades ahead of schedule,"LITTLE ROCK, Ark., Feb. 21, 2019 (GLOBE NEWSWIRE) -- Windstream (Nasdaq: WIN), a leading provider of advanced network communications and technology solutions, today announced that it completed its...",https://www.globenewswire.com/news-release/2019/02/21/1739486/13725/en/Windstream-completes-broadband-speed-upgrades-ahead-of-schedule.html,same
2/21/19,FCEL,-34.1,-29.25609756,0.036585366,gnw,"FuelCell Energy Announces First Quarter Financial Results Conference Call on March 7, 2019 at 10 A.M. Eastern Time","DANBURY, Conn., Feb. 21, 2019 (GLOBE NEWSWIRE) -- FuelCell Energy (Nasdaq: FCEL), a global leader in delivering clean, innovative and affordable fuel cell solutions for the supply, recovery and...",https://www.globenewswire.com/news-release/2019/02/21/1739283/8041/en/FuelCell-Energy-Announces-First-Quarter-Financial-Results-Conference-Call-on-March-7-2019-at-10-A-M-Eastern-Time.html,same
2/26/19,AMR,-63.3,-30.1875,2.083333333,gnw,Alta Mesa Announces Initial 2019 Outlook; Reports Preliminary Fourth Quarter and Full Year 2018 Results,"HOUSTON, Feb. 25, 2019 (GLOBE NEWSWIRE) -- Alta Mesa Resources, Inc. (NASDAQ: AMR, “Alta Mesa Resources” or the “Company”) today announced its 2019 outlook, preliminary fourth quarter 2018...",https://www.globenewswire.com/news-release/2019/02/25/1741932/8150/en/Alta-Mesa-Announces-Initial-2019-Outlook-Reports-Preliminary-Fourth-Quarter-and-Full-Year-2018-Results.html,prev
